{
  "metadata": {
    "archived_at": "2026-01-03T18:03:30.222645",
    "total_listings": 77,
    "version": "1.0"
  },
  "listings": [
    {
      "title": "JOE Listings (Job Openings for Economists)",
      "source": "aea",
      "source_url": "https://www.aeaweb.org/careers/position/listings?ListingsForm%5Bissue%5D=2025-01",
      "description": "JOE Listings (Job Openings for Economists) August 1, 2025 - January 31, 2026 This website and all of its content is provided as a service to members and customers of the American Economic Association's JOE service. All rights are reserved. The information contained on the site is for personal use only. Any commercial use of this information is strictly prohibited. You may not scrape, collect, sell, offer for sale, modify, reproduce, display, publicly perform, import, distribute, retransmit or ot",
      "deadline": "2026-01-15",
      "scraped_date": "2026-01-03",
      "source_file": "aea\\listings.html",
      "deadline_display": "January 15, 2026",
      "materials_required": {
        "other": []
      },
      "requirements": null,
      "specializations": [
        "Microeconomics"
      ],
      "start_date": null,
      "salary_range": null,
      "application_link": null,
      "application_portal": null,
      "contact_email": null,
      "contact_person": null,
      "last_updated": null,
      "campus": null,
      "id": "c31e162e64c4225a826c30237af8a3d3",
      "job_type": "other",
      "processed_date": "2026-01-03",
      "sources": [
        "aea"
      ],
      "is_active": true,
      "is_new": true
    },
    {
      "title": "Full Professor and Associate Professor",
      "source": "aea",
      "source_url": "https://www.aeaweb.org/joe/listing.php?JOE_ID=2025-02_111476988&q=eNplj0GKwzAMRe-idQZCoJscoFCYOwjV1qTuKHKQnA6h9O51IS6F2UnvS19fd_hOXpJOfsw2w3iHpEihpBvDqKtIB7-8_WWL6EwWLo0616Gsrb2ytDK5r3UZhn44fPUDdJAtTUlJTv-UkFcttqHx9GHmdOOIP1lcIps3GEhjilQYPRjNZ3kHNA6sBbPK1pDsT2ENzobnKtTHKivrKzVSvS3LAuOh72Chafd6PJ6MN19R",
      "description": "Aalborg Univeristy Time Series Analysis and Econometrics Department of Mathematical Sciences + - Full Professor and Associate Professor Date Posted: 11/26/2025 Section: International: Full-Time Academic (Permanent, Tenure Track or Tenured) Location: Aalborg, DENMARK JEL Classifications: C1 -- Econometric and Statistical Methods and Methodology: General C0 -- General Application Requirements: External Application Link Application deadline: 01/15/2026 Apply for This Job (link)",
      "deadline": "2026-01-15",
      "scraped_date": "2026-01-03",
      "source_file": "aea\\listings.html",
      "deadline_display": "January 15, 2026",
      "materials_required": {
        "other": []
      },
      "requirements": null,
      "specializations": [
        "Econometrics",
        "International",
        "Microeconomics"
      ],
      "start_date": null,
      "salary_range": null,
      "application_link": null,
      "application_portal": null,
      "contact_email": null,
      "contact_person": null,
      "last_updated": null,
      "campus": null,
      "id": "410db566d57a6ad16bd38a3aeadc2b9b",
      "job_type": "tenure-track",
      "processed_date": "2026-01-03",
      "sources": [
        "aea"
      ],
      "is_active": true,
      "is_new": true
    },
    {
      "title": "Apply for This Job (link)",
      "source": "aea",
      "source_url": "https://www.stillinger.aau.dk/videnskabelige-stillinger/vis-stilling/vacancyId/877856",
      "description": "Section: International: Full-Time Academic (Permanent, Tenure Track or Tenured) Location: Aalborg, DENMARK JEL Classifications: C1 -- Econometric and Statistical Methods and Methodology: General C0 -- General Application Requirements: External Application Link Application deadline: 01/15/2026 Apply for This Job (link)",
      "deadline": "2026-01-15",
      "scraped_date": "2026-01-03",
      "source_file": "aea\\listings.html",
      "deadline_display": "January 15, 2026",
      "materials_required": {
        "other": [],
        "letters_of_recommendation": 2026
      },
      "requirements": null,
      "specializations": [
        "Econometrics",
        "Microeconomics",
        "International"
      ],
      "start_date": null,
      "salary_range": null,
      "application_link": null,
      "application_portal": null,
      "contact_email": null,
      "contact_person": null,
      "last_updated": null,
      "campus": null,
      "id": "054089368d67e2be0f807be10cbd2764",
      "job_type": "tenure-track",
      "processed_date": "2026-01-03",
      "sources": [
        "aea"
      ],
      "is_active": true,
      "is_new": true
    },
    {
      "title": "Research Fellow",
      "source": "aea",
      "source_url": "https://www.aeaweb.org/joe/listing.php?JOE_ID=2025-02_111475967&q=eNplj0GKwzAMRe-idQZCoJscoFCYOwjV1qTuKHKQnA6h9O51IS6F2UnvS19fd_hOXpJOfsw2w3iHpEihpBvDqKtIB7-8_WWL6EwWLo0616Gsrb2ytDK5r3UZhn44fPUDdJAtTUlJTv-UkFcttqHx9GHmdOOIP1lcIps3GEhjilQYPRjNZ3kHNA6sBbPK1pDsT2ENzobnKtTHKivrKzVSvS3LAuOh72Chafd6PJ6MN19R",
      "description": "Academia Sinica Research Center for Humanities and Social Sciences + - Research Fellow Date Posted: 08/01/2025 Section: International: Full-Time Academic (Permanent, Tenure Track or Tenured) Location: Taipei, TAIWAN JEL Classification: D0 -- General Application Requirements: Application Instructions Below Application Instructions: Please send the above materials (1-6) to: cibs@ ssp.sinica.edu.tw https://hro.sinica.edu.tw/posts/135618",
      "deadline": null,
      "scraped_date": "2026-01-03",
      "source_file": "aea\\listings.html",
      "materials_required": {
        "other": []
      },
      "deadline_display": null,
      "requirements": null,
      "specializations": [
        "International",
        "Microeconomics"
      ],
      "start_date": null,
      "salary_range": null,
      "application_link": null,
      "application_portal": null,
      "contact_email": null,
      "contact_person": null,
      "last_updated": null,
      "campus": null,
      "id": "8f493ae58395d614b277af542b75dfa7",
      "job_type": "tenure-track",
      "processed_date": "2026-01-03",
      "sources": [
        "aea"
      ],
      "is_active": true,
      "is_new": true
    },
    {
      "title": "https://hro.sinica.edu.tw/posts/135618",
      "source": "aea",
      "source_url": "https://hro.sinica.edu.tw/posts/135618",
      "description": "Section: International: Full-Time Academic (Permanent, Tenure Track or Tenured) Location: Taipei, TAIWAN JEL Classification: D0 -- General Application Requirements: Application Instructions Below Application Instructions: Please send the above materials (1-6) to: cibs@ ssp.sinica.edu.tw https://hro.sinica.edu.tw/posts/135618",
      "deadline": null,
      "scraped_date": "2026-01-03",
      "source_file": "aea\\listings.html",
      "materials_required": {
        "other": []
      },
      "deadline_display": null,
      "requirements": null,
      "specializations": [
        "International",
        "Microeconomics"
      ],
      "start_date": null,
      "salary_range": null,
      "application_link": null,
      "application_portal": null,
      "contact_email": null,
      "contact_person": null,
      "last_updated": null,
      "campus": null,
      "id": "7e7e245d2d415dda7488f1e580205090",
      "job_type": "tenure-track",
      "processed_date": "2026-01-03",
      "sources": [
        "aea"
      ],
      "is_active": true,
      "is_new": true
    },
    {
      "title": "Research Economist",
      "source": "aea",
      "source_url": "https://www.aeaweb.org/joe/listing.php?JOE_ID=2025-02_111475986&q=eNplj0GKwzAMRe-idQZCoJscoFCYOwjV1qTuKHKQnA6h9O51IS6F2UnvS19fd_hOXpJOfsw2w3iHpEihpBvDqKtIB7-8_WWL6EwWLo0616Gsrb2ytDK5r3UZhn44fPUDdJAtTUlJTv-UkFcttqHx9GHmdOOIP1lcIps3GEhjilQYPRjNZ3kHNA6sBbPK1pDsT2ENzobnKtTHKivrKzVSvS3LAuOh72Chafd6PJ6MN19R",
      "description": "Andersen Institute for Finance and Economics + - Research Economist Date Posted: 08/01/2025 Section: Full-Time Nonacademic Locations: District of Columbia, Washington, UNITED STATES Remote, Washington, UNITED STATES JEL Classifications: E0 -- General F0 -- General G0 -- General J0 -- General O0 -- General D0 -- General M0 -- General Q0 -- General Application Requirements: CV Cover Letter Job Market Paper Letters of Reference https://anderseninstitute.org/about-andersen-insti ... Apply for This J",
      "deadline": null,
      "scraped_date": "2026-01-03",
      "source_file": "aea\\listings.html",
      "materials_required": {
        "cv": true,
        "cover_letter": true,
        "research_papers": "job market paper ",
        "other": []
      },
      "deadline_display": null,
      "requirements": null,
      "specializations": [
        "Finance",
        "Microeconomics"
      ],
      "start_date": null,
      "salary_range": null,
      "application_link": null,
      "application_portal": null,
      "contact_email": null,
      "contact_person": null,
      "last_updated": null,
      "campus": null,
      "id": "b541c7e428360bceb8db48069f2e9ad5",
      "job_type": "other",
      "processed_date": "2026-01-03",
      "sources": [
        "aea"
      ],
      "is_active": true,
      "is_new": true
    },
    {
      "title": "https://anderseninstitute.org/about-andersen-insti ...",
      "source": "aea",
      "source_url": "https://anderseninstitute.org/about-andersen-institute/",
      "description": "Section: Full-Time Nonacademic Locations: District of Columbia, Washington, UNITED STATES Remote, Washington, UNITED STATES JEL Classifications: E0 -- General F0 -- General G0 -- General J0 -- General O0 -- General D0 -- General M0 -- General Q0 -- General Application Requirements: CV Cover Letter Job Market Paper Letters of Reference https://anderseninstitute.org/about-andersen-insti ... Apply for This Job",
      "deadline": null,
      "scraped_date": "2026-01-03",
      "source_file": "aea\\listings.html",
      "materials_required": {
        "cv": true,
        "cover_letter": true,
        "research_papers": "job market paper ",
        "other": []
      },
      "deadline_display": null,
      "requirements": null,
      "specializations": [
        "Microeconomics"
      ],
      "start_date": null,
      "salary_range": null,
      "application_link": null,
      "application_portal": null,
      "contact_email": null,
      "contact_person": null,
      "last_updated": null,
      "campus": null,
      "id": "5e5d3c72d70f4e1672de1fbf5172736d",
      "job_type": "other",
      "processed_date": "2026-01-03",
      "sources": [
        "aea"
      ],
      "is_active": true,
      "is_new": true
    },
    {
      "title": "Assistant Professor/ Associate/ Full Professor - Economics",
      "source": "aea",
      "source_url": "https://www.aeaweb.org/joe/listing.php?JOE_ID=2025-02_111476723&q=eNplj0GKwzAMRe-idQZCoJscoFCYOwjV1qTuKHKQnA6h9O51IS6F2UnvS19fd_hOXpJOfsw2w3iHpEihpBvDqKtIB7-8_WWL6EwWLo0616Gsrb2ytDK5r3UZhn44fPUDdJAtTUlJTv-UkFcttqHx9GHmdOOIP1lcIps3GEhjilQYPRjNZ3kHNA6sBbPK1pDsT2ENzobnKtTHKivrKzVSvS3LAuOh72Chafd6PJ6MN19R",
      "description": "Ahmedabad University Economics and Public Policy Amrut Mody School of Management + - Assistant Professor/ Associate/ Full Professor - Economics Date Posted: 10/29/2025 Section: International: Full-Time Academic (Permanent, Tenure Track or Tenured) Location: AHMEDABAD, Gujarat, INDIA JEL Classifications: A1 -- General Economics G0 -- General F -- International Economics C0 -- General O3 -- Innovation; Research and Development; Technological Change; Intellectual Property Rights I1 -- Health Q5 --",
      "deadline": "2026-07-31",
      "scraped_date": "2026-01-03",
      "source_file": "aea\\listings.html",
      "deadline_display": "July 31, 2026",
      "materials_required": {
        "other": []
      },
      "requirements": null,
      "specializations": [
        "Development",
        "International",
        "Microeconomics",
        "Public"
      ],
      "start_date": null,
      "salary_range": null,
      "application_link": null,
      "application_portal": null,
      "contact_email": null,
      "contact_person": null,
      "last_updated": null,
      "campus": null,
      "id": "02a105b67c6245671ffae333bdf13681",
      "job_type": "tenure-track",
      "processed_date": "2026-01-03",
      "sources": [
        "aea"
      ],
      "is_active": true,
      "is_new": true
    },
    {
      "title": "Apply for This Job",
      "source": "aea",
      "source_url": null,
      "description": "Section: International: Full-Time Academic (Permanent, Tenure Track or Tenured) Location: AHMEDABAD, Gujarat, INDIA JEL Classifications: A1 -- General Economics G0 -- General F -- International Economics C0 -- General O3 -- Innovation; Research and Development; Technological Change; Intellectual Property Rights I1 -- Health Q5 -- Environmental Economics C7 -- Game Theory and Bargaining Theory Application Requirements: Cover Letter CV Letters of Reference Research Papers Job Market Paper Teaching",
      "deadline": "2026-07-31",
      "scraped_date": "2026-01-03",
      "source_file": "aea\\listings.html",
      "deadline_display": "July 31, 2026",
      "materials_required": {
        "cv": true,
        "cover_letter": true,
        "research_papers": "job market paper ",
        "other": []
      },
      "requirements": null,
      "specializations": [
        "Development",
        "International",
        "Microeconomics"
      ],
      "start_date": null,
      "salary_range": null,
      "application_link": null,
      "application_portal": null,
      "contact_email": null,
      "contact_person": null,
      "last_updated": null,
      "campus": null,
      "id": "56a8b24937cb928596b92db708abc3a7",
      "job_type": "tenure-track",
      "processed_date": "2026-01-03",
      "sources": [
        "aea"
      ],
      "is_active": true,
      "is_new": true
    },
    {
      "title": "Program Associate, Economics",
      "source": "aea",
      "source_url": "https://www.aeaweb.org/joe/listing.php?JOE_ID=2025-02_111477037&q=eNplj0GKwzAMRe-idQZCoJscoFCYOwjV1qTuKHKQnA6h9O51IS6F2UnvS19fd_hOXpJOfsw2w3iHpEihpBvDqKtIB7-8_WWL6EwWLo0616Gsrb2ytDK5r3UZhn44fPUDdJAtTUlJTv-UkFcttqHx9GHmdOOIP1lcIps3GEhjilQYPRjNZ3kHNA6sBbPK1pDsT2ENzobnKtTHKivrKzVSvS3LAuOh72Chafd6PJ6MN19R",
      "description": "Alfred P. Sloan Foundation + - Program Associate, Economics Date Posted: 12/02/2025 Section: Full-Time Nonacademic Location: New York, New York, UNITED STATES JEL Classifications: A1 -- General Economics C1 -- Econometric and Statistical Methods and Methodology: General O3 -- Innovation; Research and Development; Technological Change; Intellectual Property Rights H4 -- Publicly Provided Goods Application Requirements: External Application URL and Instructions Below Application deadline: 05/31/20",
      "deadline": "2026-05-31",
      "scraped_date": "2026-01-03",
      "source_file": "aea\\listings.html",
      "deadline_display": "May 31, 2026",
      "materials_required": {
        "other": []
      },
      "requirements": null,
      "specializations": [
        "Development",
        "Econometrics",
        "Microeconomics"
      ],
      "start_date": null,
      "salary_range": null,
      "application_link": null,
      "application_portal": null,
      "contact_email": null,
      "contact_person": null,
      "last_updated": null,
      "campus": null,
      "id": "9e187b2deee7cf8a29757b564e30b45e",
      "job_type": "other",
      "processed_date": "2026-01-03",
      "sources": [
        "aea"
      ],
      "is_active": true,
      "is_new": true
    },
    {
      "title": "Apply for This Job (link)",
      "source": "aea",
      "source_url": "https://sloan.org/about/careers",
      "description": "Section: Full-Time Nonacademic Location: New York, New York, UNITED STATES JEL Classifications: A1 -- General Economics C1 -- Econometric and Statistical Methods and Methodology: General O3 -- Innovation; Research and Development; Technological Change; Intellectual Property Rights H4 -- Publicly Provided Goods Application Requirements: External Application URL and Instructions Below Application deadline: 05/31/2026 Application Instructions: Applicants should all go to the Sloan website https://s",
      "deadline": "2026-05-31",
      "scraped_date": "2026-01-03",
      "source_file": "aea\\listings.html",
      "deadline_display": "May 31, 2026",
      "materials_required": {
        "other": []
      },
      "requirements": null,
      "specializations": [
        "Development",
        "Econometrics",
        "Microeconomics"
      ],
      "start_date": null,
      "salary_range": null,
      "application_link": null,
      "application_portal": null,
      "contact_email": null,
      "contact_person": null,
      "last_updated": null,
      "campus": null,
      "id": "fa7cbbca019737e89f14a54b1c968c2c",
      "job_type": "other",
      "processed_date": "2026-01-03",
      "sources": [
        "aea"
      ],
      "is_active": true,
      "is_new": true
    },
    {
      "title": "Assistant Professor",
      "source": "aea",
      "source_url": "https://www.aeaweb.org/joe/listing.php?JOE_ID=2025-02_111476216&q=eNplj0GKwzAMRe-idQZCoJscoFCYOwjV1qTuKHKQnA6h9O51IS6F2UnvS19fd_hOXpJOfsw2w3iHpEihpBvDqKtIB7-8_WWL6EwWLo0616Gsrb2ytDK5r3UZhn44fPUDdJAtTUlJTv-UkFcttqHx9GHmdOOIP1lcIps3GEhjilQYPRjNZ3kHNA6sBbPK1pDsT2ENzobnKtTHKivrKzVSvS3LAuOh72Chafd6PJ6MN19R",
      "description": "American University College of Arts and Sciences Departments of Economics and Health Studies + - Assistant Professor Date Posted: 09/16/2025 Section: US: Full-Time Academic (Permanent, Tenure Track or Tenured) Location: Washington, District of Columbia, UNITED STATES JEL Classification: I1 -- Health Application Requirements: External Application URL and Instructions Below Application deadline: 11/30/2025 Application Instructions: Review of applications will begin on November 15, 2025 and will co",
      "deadline": "2025-11-30",
      "scraped_date": "2026-01-03",
      "source_file": "aea\\listings.html",
      "deadline_display": "November 30, 2025",
      "materials_required": {
        "other": []
      },
      "requirements": null,
      "specializations": [
        "Microeconomics"
      ],
      "start_date": null,
      "salary_range": null,
      "application_link": null,
      "application_portal": null,
      "contact_email": null,
      "contact_person": null,
      "last_updated": null,
      "campus": null,
      "id": "202861b2a3be762fa7376af23666c8a7",
      "job_type": "tenure-track",
      "processed_date": "2026-01-03",
      "sources": [
        "aea"
      ],
      "is_active": false,
      "is_new": true
    },
    {
      "title": "Apply for This Job (link)",
      "source": "aea",
      "source_url": "https://apply.interfolio.com/175072",
      "description": "Section: US: Full-Time Academic (Permanent, Tenure Track or Tenured) Location: Washington, District of Columbia, UNITED STATES JEL Classification: I1 -- Health Application Requirements: External Application URL and Instructions Below Application deadline: 11/30/2025 Application Instructions: Review of applications will begin on November 15, 2025 and will continue until the position is filled, subject to ongoing budgetary approval. Include a cover letter of application (up to 2 pages) which expla",
      "deadline": "2025-11-30",
      "scraped_date": "2026-01-03",
      "source_file": "aea\\listings.html",
      "deadline_display": "November 30, 2025",
      "materials_required": {
        "cover_letter": true,
        "other": []
      },
      "requirements": null,
      "specializations": [
        "Finance",
        "International",
        "Microeconomics"
      ],
      "start_date": null,
      "salary_range": null,
      "application_link": null,
      "application_portal": null,
      "contact_email": null,
      "contact_person": null,
      "last_updated": null,
      "campus": null,
      "id": "2b5436353dbeeb8886c73a5759f9c13d",
      "job_type": "tenure-track",
      "processed_date": "2026-01-03",
      "sources": [
        "aea"
      ],
      "is_active": false,
      "is_new": true
    },
    {
      "title": "All ranks",
      "source": "aea",
      "source_url": "https://www.aeaweb.org/joe/listing.php?JOE_ID=2025-02_111476768&q=eNplj0GKwzAMRe-idQZCoJscoFCYOwjV1qTuKHKQnA6h9O51IS6F2UnvS19fd_hOXpJOfsw2w3iHpEihpBvDqKtIB7-8_WWL6EwWLo0616Gsrb2ytDK5r3UZhn44fPUDdJAtTUlJTv-UkFcttqHx9GHmdOOIP1lcIps3GEhjilQYPRjNZ3kHNA6sBbPK1pDsT2ENzobnKtTHKivrKzVSvS3LAuOh72Chafd6PJ6MN19R",
      "description": "Ashoka University Economics + - All ranks Date Posted: 10/27/2025 Section: International: Full-Time Academic (Permanent, Tenure Track or Tenured) Location: Sonipat, Haryana, INDIA JEL Classifications: G -- Financial Economics Q -- Agricultural and Natural Resource Economics; Environmental and Ecological Economics 00 -- 00 - Default: Any Field Application Requirements: External Application URL and Instructions Below Letters of Reference Link Application deadline: 11/30/2025 Application Instructio",
      "deadline": "2025-11-30",
      "scraped_date": "2026-01-03",
      "source_file": "aea\\listings.html",
      "deadline_display": "November 30, 2025",
      "materials_required": {
        "other": []
      },
      "requirements": null,
      "specializations": [
        "Finance",
        "International",
        "Microeconomics"
      ],
      "start_date": null,
      "salary_range": null,
      "application_link": null,
      "application_portal": null,
      "contact_email": null,
      "contact_person": null,
      "last_updated": null,
      "campus": null,
      "id": "db4239214dc5566596b08fe3f2d20a3f",
      "job_type": "tenure-track",
      "processed_date": "2026-01-03",
      "sources": [
        "aea"
      ],
      "is_active": false,
      "is_new": true
    },
    {
      "title": "Economist / Senior Economist / Principal Economist",
      "source": "aea",
      "source_url": "https://www.aeaweb.org/joe/listing.php?JOE_ID=2025-02_111476885&q=eNplj0GKwzAMRe-idQZCoJscoFCYOwjV1qTuKHKQnA6h9O51IS6F2UnvS19fd_hOXpJOfsw2w3iHpEihpBvDqKtIB7-8_WWL6EwWLo0616Gsrb2ytDK5r3UZhn44fPUDdJAtTUlJTv-UkFcttqHx9GHmdOOIP1lcIps3GEhjilQYPRjNZ3kHNA6sBbPK1pDsT2ENzobnKtTHKivrKzVSvS3LAuOh72Chafd6PJ6MN19R",
      "description": "Bank for International Settlements (BIS) Monetary and Economic Department (MED) + - Economist / Senior Economist / Principal Economist Date Posted: 11/07/2025 Section: Full-Time Nonacademic Location: Basel, SWITZERLAND JEL Classifications: E0 -- General F3 -- International Finance G1 -- General Financial Markets G2 -- Financial Institutions and Services Application Requirements: CV Research Papers Question and Answer Letters of Reference Application deadline: 11/30/2025 Application Deadline Has",
      "deadline": "2025-11-30",
      "scraped_date": "2026-01-03",
      "source_file": "aea\\listings.html",
      "deadline_display": "November 30, 2025",
      "materials_required": {
        "cv": true,
        "research_papers": true,
        "other": []
      },
      "requirements": null,
      "specializations": [
        "Finance",
        "International",
        "Macroeconomics",
        "Microeconomics"
      ],
      "start_date": null,
      "salary_range": null,
      "application_link": null,
      "application_portal": null,
      "contact_email": null,
      "contact_person": null,
      "last_updated": null,
      "campus": null,
      "id": "d4791a3323d937ed2dbf2d83ee9e74ca",
      "job_type": "other",
      "processed_date": "2026-01-03",
      "sources": [
        "aea"
      ],
      "is_active": false,
      "is_new": true
    },
    {
      "title": "Assistant, Associate or Full Professor",
      "source": "aea",
      "source_url": "https://www.aeaweb.org/joe/listing.php?JOE_ID=2025-02_111477120&q=eNplj0GKwzAMRe-idQZCoJscoFCYOwjV1qTuKHKQnA6h9O51IS6F2UnvS19fd_hOXpJOfsw2w3iHpEihpBvDqKtIB7-8_WWL6EwWLo0616Gsrb2ytDK5r3UZhn44fPUDdJAtTUlJTv-UkFcttqHx9GHmdOOIP1lcIps3GEhjilQYPRjNZ3kHNA6sBbPK1pDsT2ENzobnKtTHKivrKzVSvS3LAuOh72Chafd6PJ6MN19R",
      "description": "American University in Cairo Economic Development & Quantitative Economics + - Assistant, Associate or Full Professor Date Posted: 12/26/2025 Section: International: Full-Time Academic (Permanent, Tenure Track or Tenured) Location: Carcassonne, Occitanie, FRANCE JEL Classification: O1 -- Economic Development Application Requirements: External Application Link Letters of Reference Link Application deadline: 06/15/2026 Apply for This Job (link) Request References (link)",
      "deadline": "2026-06-15",
      "scraped_date": "2026-01-03",
      "source_file": "aea\\listings.html",
      "deadline_display": "June 15, 2026",
      "materials_required": {
        "letters_of_recommendation": true,
        "other": []
      },
      "requirements": null,
      "specializations": [
        "Development",
        "International",
        "Microeconomics"
      ],
      "start_date": null,
      "salary_range": null,
      "application_link": null,
      "application_portal": null,
      "contact_email": null,
      "contact_person": null,
      "last_updated": null,
      "campus": null,
      "id": "20c613ed5154f789ae8d86bdc4088e4b",
      "job_type": "tenure-track",
      "processed_date": "2026-01-03",
      "sources": [
        "aea"
      ],
      "is_active": true,
      "is_new": true
    },
    {
      "title": "Apply for This Job (link)",
      "source": "aea",
      "source_url": "https://www.click2apply.net/KgGzyofaPEY8ZSB2miLdrG",
      "description": "Section: International: Full-Time Academic (Permanent, Tenure Track or Tenured) Location: Carcassonne, Occitanie, FRANCE JEL Classification: O1 -- Economic Development Application Requirements: External Application Link Letters of Reference Link Application deadline: 06/15/2026 Apply for This Job (link) Request References (link)",
      "deadline": "2026-06-15",
      "scraped_date": "2026-01-03",
      "source_file": "aea\\listings.html",
      "deadline_display": "June 15, 2026",
      "materials_required": {
        "letters_of_recommendation": true,
        "other": []
      },
      "requirements": null,
      "specializations": [
        "Development",
        "International",
        "Microeconomics"
      ],
      "start_date": null,
      "salary_range": null,
      "application_link": null,
      "application_portal": null,
      "contact_email": null,
      "contact_person": null,
      "last_updated": null,
      "campus": null,
      "id": "73ae3506a6c1ab2d2142746492687b7b",
      "job_type": "tenure-track",
      "processed_date": "2026-01-03",
      "sources": [
        "aea"
      ],
      "is_active": true,
      "is_new": true
    },
    {
      "title": "Assistant Professor",
      "source": "aea",
      "source_url": "https://www.aeaweb.org/joe/listing.php?JOE_ID=2025-02_111476837&q=eNplj0GKwzAMRe-idQZCoJscoFCYOwjV1qTuKHKQnA6h9O51IS6F2UnvS19fd_hOXpJOfsw2w3iHpEihpBvDqKtIB7-8_WWL6EwWLo0616Gsrb2ytDK5r3UZhn44fPUDdJAtTUlJTv-UkFcttqHx9GHmdOOIP1lcIps3GEhjilQYPRjNZ3kHNA6sBbPK1pDsT2ENzobnKtTHKivrKzVSvS3LAuOh72Chafd6PJ6MN19R",
      "description": "American University of Sharjah School of Business Administration Department of Economics + - Assistant Professor Date Posted: 11/10/2025 Section: International: Full-Time Academic (Permanent, Tenure Track or Tenured) Location: Sharjah, Sharjah, UNITED ARAB EMIRATES JEL Classification: 00 -- 00 - Default: Any Field Application Requirements: Cover Letter Letters of Reference CV Job Market Paper Application deadline: 01/31/2026 Apply for This Job",
      "deadline": "2026-01-31",
      "scraped_date": "2026-01-03",
      "source_file": "aea\\listings.html",
      "deadline_display": "January 31, 2026",
      "materials_required": {
        "cv": true,
        "cover_letter": true,
        "research_papers": "job market paper ",
        "other": []
      },
      "requirements": null,
      "specializations": [
        "International",
        "Microeconomics"
      ],
      "start_date": null,
      "salary_range": null,
      "application_link": null,
      "application_portal": null,
      "contact_email": null,
      "contact_person": null,
      "last_updated": null,
      "campus": null,
      "id": "bec1209cd51216a9286b707390fdaa5a",
      "job_type": "tenure-track",
      "processed_date": "2026-01-03",
      "sources": [
        "aea"
      ],
      "is_active": true,
      "is_new": true
    },
    {
      "title": "Apply for This Job",
      "source": "aea",
      "source_url": null,
      "description": "Section: International: Full-Time Academic (Permanent, Tenure Track or Tenured) Location: Sharjah, Sharjah, UNITED ARAB EMIRATES JEL Classification: 00 -- 00 - Default: Any Field Application Requirements: Cover Letter Letters of Reference CV Job Market Paper Application deadline: 01/31/2026 Apply for This Job",
      "deadline": "2026-01-31",
      "scraped_date": "2026-01-03",
      "source_file": "aea\\listings.html",
      "deadline_display": "January 31, 2026",
      "materials_required": {
        "cv": true,
        "cover_letter": true,
        "research_papers": "job market paper ",
        "other": []
      },
      "requirements": null,
      "specializations": [
        "Macroeconomics",
        "International",
        "Microeconomics"
      ],
      "start_date": null,
      "salary_range": null,
      "application_link": null,
      "application_portal": null,
      "contact_email": null,
      "contact_person": null,
      "last_updated": null,
      "campus": null,
      "id": "88be2317eed3481fef289a7de1a23e75",
      "job_type": "tenure-track",
      "processed_date": "2026-01-03",
      "sources": [
        "aea"
      ],
      "is_active": true,
      "is_new": true
    },
    {
      "title": "https://wpcarey.asu.edu/economics-degrees",
      "source": "aea",
      "source_url": "https://wpcarey.asu.edu/economics-degrees",
      "description": "Section: US: Full-Time Academic (Permanent, Tenure Track or Tenured) Location: Tempe, Arizona, UNITED STATES JEL Classification: 00 -- 00 - Default: Any Field Application Requirements: External Application Link Application deadline: 01/31/2026 https://wpcarey.asu.edu/economics-degrees https://www.asu.edu/aad/manuals/acd/acd401.html an... Apply for This Job (link)",
      "deadline": "2026-01-31",
      "scraped_date": "2026-01-03",
      "source_file": "aea\\listings.html",
      "deadline_display": "January 31, 2026",
      "materials_required": {
        "other": []
      },
      "requirements": null,
      "specializations": [
        "Microeconomics"
      ],
      "start_date": null,
      "salary_range": null,
      "application_link": null,
      "application_portal": null,
      "contact_email": null,
      "contact_person": null,
      "last_updated": null,
      "campus": null,
      "id": "74d3ce695821355012b4398919ebdd22",
      "job_type": "tenure-track",
      "processed_date": "2026-01-03",
      "sources": [
        "aea"
      ],
      "is_active": true,
      "is_new": true
    },
    {
      "title": "Postdoc/Assistant Professor/Associate Professor",
      "source": "aea",
      "source_url": "https://www.aeaweb.org/joe/listing.php?JOE_ID=2025-02_111475963&q=eNplj0GKwzAMRe-idQZCoJscoFCYOwjV1qTuKHKQnA6h9O51IS6F2UnvS19fd_hOXpJOfsw2w3iHpEihpBvDqKtIB7-8_WWL6EwWLo0616Gsrb2ytDK5r3UZhn44fPUDdJAtTUlJTv-UkFcttqHx9GHmdOOIP1lcIps3GEhjilQYPRjNZ3kHNA6sBbPK1pDsT2ENzobnKtTHKivrKzVSvS3LAuOh72Chafd6PJ6MN19R",
      "description": "Beijing Institute of Mathematical Sciences and Applications Digital Economy Lab + - Postdoc/Assistant Professor/Associate Professor Date Posted: 08/01/2025 Section: International: Other Academic (Visiting or Temporary) Location: Beijing, Beijing, CHINA JEL Classifications: O -- Economic Development, Innovation, Technological Change, and Growth L -- Industrial Organization J -- Labor and Demographic Economics G -- Financial Economics C -- Mathematical and Quantitative Methods Z -- Other Special T",
      "deadline": "2026-01-31",
      "scraped_date": "2026-01-03",
      "source_file": "aea\\listings.html",
      "deadline_display": "January 31, 2026",
      "materials_required": {
        "other": []
      },
      "requirements": null,
      "specializations": [
        "Development",
        "Finance",
        "International",
        "Labor",
        "Macroeconomics",
        "Microeconomics"
      ],
      "start_date": null,
      "salary_range": null,
      "application_link": null,
      "application_portal": null,
      "contact_email": null,
      "contact_person": null,
      "last_updated": null,
      "campus": null,
      "id": "ae6e9c97623854dd648f6f22866124d2",
      "job_type": "tenure-track",
      "processed_date": "2026-01-03",
      "sources": [
        "aea"
      ],
      "is_active": true,
      "is_new": true
    },
    {
      "title": "https://www.bimsa.cn/join/join_faculty.html",
      "source": "aea",
      "source_url": "https://www.bimsa.cn/join/join_faculty.html",
      "description": "Section: International: Other Academic (Visiting or Temporary) Location: Beijing, Beijing, CHINA JEL Classifications: O -- Economic Development, Innovation, Technological Change, and Growth L -- Industrial Organization J -- Labor and Demographic Economics G -- Financial Economics C -- Mathematical and Quantitative Methods Z -- Other Special Topics D -- Microeconomics Application Requirements: Cover Letter Dissertation abstract Letters of Reference Research Papers Teaching Evaluations Job Market",
      "deadline": "2026-01-31",
      "scraped_date": "2026-01-03",
      "source_file": "aea\\listings.html",
      "deadline_display": "January 31, 2026",
      "materials_required": {
        "cover_letter": true,
        "research_papers": true,
        "other": []
      },
      "requirements": null,
      "specializations": [
        "Development",
        "Finance",
        "International",
        "Labor",
        "Macroeconomics",
        "Microeconomics"
      ],
      "start_date": null,
      "salary_range": null,
      "application_link": null,
      "application_portal": null,
      "contact_email": null,
      "contact_person": null,
      "last_updated": null,
      "campus": null,
      "id": "ef4bc0068fa4df22776fc4b9562a7ade",
      "job_type": "visiting",
      "processed_date": "2026-01-03",
      "sources": [
        "aea"
      ],
      "is_active": true,
      "is_new": true
    },
    {
      "title": "Lecturer/Senior Lecturer/Associate/Full Professor",
      "source": "aea",
      "source_url": "https://www.aeaweb.org/joe/listing.php?JOE_ID=2025-02_111476196&q=eNplj0GKwzAMRe-idQZCoJscoFCYOwjV1qTuKHKQnA6h9O51IS6F2UnvS19fd_hOXpJOfsw2w3iHpEihpBvDqKtIB7-8_WWL6EwWLo0616Gsrb2ytDK5r3UZhn44fPUDdJAtTUlJTv-UkFcttqHx9GHmdOOIP1lcIps3GEhjilQYPRjNZ3kHNA6sBbPK1pDsT2ENzobnKtTHKivrKzVSvS3LAuOh72Chafd6PJ6MN19R",
      "description": "Ben-Gurion University of the Negev Economics + - Lecturer/Senior Lecturer/Associate/Full Professor Date Posted: 09/16/2025 Section: International: Full-Time Academic (Permanent, Tenure Track or Tenured) Location: Beer-Sheva, ISRAEL JEL Classifications: 00 -- 00 - Default: Any Field E -- Macroeconomics and Monetary Economics Application Requirements: Letters of Reference Teaching Evaluations Job Market Paper Cover Letter CV Application deadline: 01/31/2026 Apply for This Job",
      "deadline": "2026-01-31",
      "scraped_date": "2026-01-03",
      "source_file": "aea\\listings.html",
      "deadline_display": "January 31, 2026",
      "materials_required": {
        "cv": true,
        "cover_letter": true,
        "research_papers": "job market paper ",
        "other": []
      },
      "requirements": null,
      "specializations": [
        "International",
        "Macroeconomics",
        "Microeconomics"
      ],
      "start_date": null,
      "salary_range": null,
      "application_link": null,
      "application_portal": null,
      "contact_email": null,
      "contact_person": null,
      "last_updated": null,
      "campus": null,
      "id": "3df5b33e7fe260045220486690c69b6b",
      "job_type": "lecturer",
      "processed_date": "2026-01-03",
      "sources": [
        "aea"
      ],
      "is_active": true,
      "is_new": true
    },
    {
      "title": "Assistant Professor (2) of Economics",
      "source": "aea",
      "source_url": "https://www.aeaweb.org/joe/listing.php?JOE_ID=2025-02_111476071&q=eNplj0GKwzAMRe-idQZCoJscoFCYOwjV1qTuKHKQnA6h9O51IS6F2UnvS19fd_hOXpJOfsw2w3iHpEihpBvDqKtIB7-8_WWL6EwWLo0616Gsrb2ytDK5r3UZhn44fPUDdJAtTUlJTv-UkFcttqHx9GHmdOOIP1lcIps3GEhjilQYPRjNZ3kHNA6sBbPK1pDsT2ENzobnKtTHKivrKzVSvS3LAuOh72Chafd6PJ6MN19R",
      "description": "Bowdoin College Economics + - Assistant Professor (2) of Economics Date Posted: 08/19/2025 Section: US: Full-Time Academic (Permanent, Tenure Track or Tenured) Location: Brunswick, Maine, UNITED STATES JEL Classifications: 00 -- 00 - Default: Any Field E0 -- General H0 -- General I1 -- Health Application Requirements: External Application Link Application deadline: 01/31/2026 http://www.bowdoin.edu Apply for This Job (link)",
      "deadline": "2026-01-31",
      "scraped_date": "2026-01-03",
      "source_file": "aea\\listings.html",
      "deadline_display": "January 31, 2026",
      "materials_required": {
        "other": []
      },
      "requirements": null,
      "specializations": [
        "Microeconomics"
      ],
      "start_date": null,
      "salary_range": null,
      "application_link": null,
      "application_portal": null,
      "contact_email": null,
      "contact_person": null,
      "last_updated": null,
      "campus": null,
      "id": "bf7d1a968270d19b503ff26c9970343f",
      "job_type": "tenure-track",
      "processed_date": "2026-01-03",
      "sources": [
        "aea"
      ],
      "is_active": true,
      "is_new": true
    },
    {
      "title": "http://www.bowdoin.edu",
      "source": "aea",
      "source_url": "http://www.bowdoin.edu",
      "description": "Section: US: Full-Time Academic (Permanent, Tenure Track or Tenured) Location: Brunswick, Maine, UNITED STATES JEL Classifications: 00 -- 00 - Default: Any Field E0 -- General H0 -- General I1 -- Health Application Requirements: External Application Link Application deadline: 01/31/2026 http://www.bowdoin.edu Apply for This Job (link)",
      "deadline": "2026-01-31",
      "scraped_date": "2026-01-03",
      "source_file": "aea\\listings.html",
      "deadline_display": "January 31, 2026",
      "materials_required": {
        "other": []
      },
      "requirements": null,
      "specializations": [
        "Microeconomics"
      ],
      "start_date": null,
      "salary_range": null,
      "application_link": null,
      "application_portal": null,
      "contact_email": null,
      "contact_person": null,
      "last_updated": null,
      "campus": null,
      "id": "9406d9d32610db17a1363eac3998fb32",
      "job_type": "tenure-track",
      "processed_date": "2026-01-03",
      "sources": [
        "aea"
      ],
      "is_active": true,
      "is_new": true
    },
    {
      "title": "Assistant Professor (Tenure-Track) - Department of Politics, Governance & Economics",
      "source": "aea",
      "source_url": "https://www.aeaweb.org/joe/listing.php?JOE_ID=2025-02_111476059&q=eNplj0GKwzAMRe-idQZCoJscoFCYOwjV1qTuKHKQnA6h9O51IS6F2UnvS19fd_hOXpJOfsw2w3iHpEihpBvDqKtIB7-8_WWL6EwWLo0616Gsrb2ytDK5r3UZhn44fPUDdJAtTUlJTv-UkFcttqHx9GHmdOOIP1lcIps3GEhjilQYPRjNZ3kHNA6sBbPK1pDsT2ENzobnKtTHKivrKzVSvS3LAuOh72Chafd6PJ6MN19R",
      "description": "American University | School of International Service Department of Politics, Governance & Economics + - Assistant Professor (Tenure-Track) - Department of Politics, Governance & Economics Date Posted: 08/18/2025 Section: US: Full-Time Academic (Permanent, Tenure Track or Tenured) Location: Washington, District of Columbia, UNITED STATES JEL Classifications: 00 -- 00 - Default: Any Field F5 -- International Relations, National Security, and International Political Economy Application Requirement",
      "deadline": "2025-09-15",
      "scraped_date": "2026-01-03",
      "source_file": "aea\\listings.html",
      "deadline_display": "September 15, 2025",
      "materials_required": {
        "other": []
      },
      "requirements": null,
      "specializations": [
        "International",
        "Microeconomics"
      ],
      "start_date": null,
      "salary_range": null,
      "application_link": null,
      "application_portal": null,
      "contact_email": null,
      "contact_person": null,
      "last_updated": null,
      "campus": null,
      "id": "dd0bf56af627243758aaba5706a3da1d",
      "job_type": "tenure-track",
      "processed_date": "2026-01-03",
      "sources": [
        "aea"
      ],
      "is_active": false,
      "is_new": true
    },
    {
      "title": "Apply for This Job (link)",
      "source": "aea",
      "source_url": "https://american.wd1.myworkdayjobs.com/AU/job/Main-Campus-Washington-DC/Assistant-Professor--Tenure-Track----Department-of-Politics--Governance---Economics_R2983-1",
      "description": "Section: US: Full-Time Academic (Permanent, Tenure Track or Tenured) Location: Washington, District of Columbia, UNITED STATES JEL Classifications: 00 -- 00 - Default: Any Field F5 -- International Relations, National Security, and International Political Economy Application Requirements: External Application URL and Instructions Below Letters of Reference Instructions Below Application deadline: 09/15/2025 Reference Instructions: Reference letters must be submitted through the Workday applicati",
      "deadline": "2025-09-15",
      "scraped_date": "2026-01-03",
      "source_file": "aea\\listings.html",
      "deadline_display": "September 15, 2025",
      "materials_required": {
        "letters_of_recommendation": 2025,
        "other": []
      },
      "requirements": null,
      "specializations": [
        "International",
        "Microeconomics"
      ],
      "start_date": null,
      "salary_range": null,
      "application_link": null,
      "application_portal": null,
      "contact_email": null,
      "contact_person": null,
      "last_updated": null,
      "campus": null,
      "id": "453fb6f78bd8e992ae3a886f596f6ba2",
      "job_type": "tenure-track",
      "processed_date": "2026-01-03",
      "sources": [
        "aea"
      ],
      "is_active": false,
      "is_new": true
    },
    {
      "title": "Associate",
      "source": "aea",
      "source_url": "https://www.aeaweb.org/joe/listing.php?JOE_ID=2025-02_111476201&q=eNplj0GKwzAMRe-idQZCoJscoFCYOwjV1qTuKHKQnA6h9O51IS6F2UnvS19fd_hOXpJOfsw2w3iHpEihpBvDqKtIB7-8_WWL6EwWLo0616Gsrb2ytDK5r3UZhn44fPUDdJAtTUlJTv-UkFcttqHx9GHmdOOIP1lcIps3GEhjilQYPRjNZ3kHNA6sBbPK1pDsT2ENzobnKtTHKivrKzVSvS3LAuOh72Chafd6PJ6MN19R",
      "description": "Analysis Group + - Associate Date Posted: 09/15/2025 Section: Full-Time Nonacademic Locations: Boston, Massachusetts, UNITED STATES Chicago, Illinois, UNITED STATES Dallas, Texas, UNITED STATES Denver, Colorado, UNITED STATES Los Angeles, California, UNITED STATES New York, New York, UNITED STATES San Francisco, California, UNITED STATES Washington, DC, District of Columbia, UNITED STATES JEL Classifications: D -- Microeconomics G -- Financial Economics J -- Labor and Demographic Economics I1 --",
      "deadline": "2025-11-17",
      "scraped_date": "2026-01-03",
      "source_file": "aea\\listings.html",
      "deadline_display": "November 17, 2025",
      "materials_required": {
        "other": []
      },
      "requirements": null,
      "specializations": [
        "Finance",
        "Labor",
        "Microeconomics"
      ],
      "start_date": null,
      "salary_range": null,
      "application_link": null,
      "application_portal": null,
      "contact_email": null,
      "contact_person": null,
      "last_updated": null,
      "campus": null,
      "id": "d63af0f885b1eaaa1b41b09b2e579d55",
      "job_type": "other",
      "processed_date": "2026-01-03",
      "sources": [
        "aea"
      ],
      "is_active": false,
      "is_new": true
    },
    {
      "title": "https://www.analysisgroup.com/associate-pay/",
      "source": "aea",
      "source_url": "https://www.analysisgroup.com/associate-pay/",
      "description": "Section: Full-Time Nonacademic Locations: Boston, Massachusetts, UNITED STATES Chicago, Illinois, UNITED STATES Dallas, Texas, UNITED STATES Denver, Colorado, UNITED STATES Los Angeles, California, UNITED STATES New York, New York, UNITED STATES San Francisco, California, UNITED STATES Washington, DC, District of Columbia, UNITED STATES JEL Classifications: D -- Microeconomics G -- Financial Economics J -- Labor and Demographic Economics I1 -- Health L -- Industrial Organization M -- Business Ad",
      "deadline": "2025-11-17",
      "scraped_date": "2026-01-03",
      "source_file": "aea\\listings.html",
      "deadline_display": "November 17, 2025",
      "materials_required": {
        "other": []
      },
      "requirements": null,
      "specializations": [
        "Finance",
        "Labor",
        "Microeconomics"
      ],
      "start_date": null,
      "salary_range": null,
      "application_link": null,
      "application_portal": null,
      "contact_email": null,
      "contact_person": null,
      "last_updated": null,
      "campus": null,
      "id": "5ddde4a46b38851ad05e045239021104",
      "job_type": "other",
      "processed_date": "2026-01-03",
      "sources": [
        "aea"
      ],
      "is_active": false,
      "is_new": true
    },
    {
      "title": "Apply for This Job (link)",
      "source": "aea",
      "source_url": "https://associatecareers-analysisgroup.icims.com/jobs/2760/associate---generalist---montreal---toronto-%282026-start-date%29/job",
      "description": "Section: Full-Time Nonacademic Locations: Toronto, ON, CANADA Montreal, QC, CANADA JEL Classifications: D -- Microeconomics G -- Financial Economics I1 -- Health L -- Industrial Organization M -- Business Administration and Business Economics; Marketing; Accounting; Personnel Economics Application Requirements: External Application URL and Instructions Below Letters of Reference Instructions Below Application deadline: 11/17/2025 Reference Instructions: To be considered, you must submit three le",
      "deadline": "2025-11-17",
      "scraped_date": "2026-01-03",
      "source_file": "aea\\listings.html",
      "deadline_display": "November 17, 2025",
      "materials_required": {
        "letters_of_recommendation": 2025,
        "other": []
      },
      "requirements": null,
      "specializations": [
        "Finance",
        "Microeconomics"
      ],
      "start_date": null,
      "salary_range": null,
      "application_link": null,
      "application_portal": null,
      "contact_email": null,
      "contact_person": null,
      "last_updated": null,
      "campus": null,
      "id": "b08dd7239b571280aa239c79a15ca2d4",
      "job_type": "other",
      "processed_date": "2026-01-03",
      "sources": [
        "aea"
      ],
      "is_active": false,
      "is_new": true
    },
    {
      "title": "Postdoctoral Research Associate",
      "source": "aea",
      "source_url": "https://www.aeaweb.org/joe/listing.php?JOE_ID=2025-02_111476972&q=eNplj0GKwzAMRe-idQZCoJscoFCYOwjV1qTuKHKQnA6h9O51IS6F2UnvS19fd_hOXpJOfsw2w3iHpEihpBvDqKtIB7-8_WWL6EwWLo0616Gsrb2ytDK5r3UZhn44fPUDdJAtTUlJTv-UkFcttqHx9GHmdOOIP1lcIps3GEhjilQYPRjNZ3kHNA6sBbPK1pDsT2ENzobnKtTHKivrKzVSvS3LAuOh72Chafd6PJ6MN19R",
      "description": "Annenberg Institute at Brown University + - Postdoctoral Research Associate Date Posted: 11/26/2025 Section: US: Other Academic (Visiting or Temporary) Location: Providence, Rhode Island, UNITED STATES JEL Classification: 00 -- 00 - Default: Any Field Application Requirements: External Application URL and Instructions Below Application deadline: 12/31/2025 Application Instructions: Review of applications will begin in January 2026. Applications received by December 31, 2025 will be considered pr",
      "deadline": "2025-12-31",
      "scraped_date": "2026-01-03",
      "source_file": "aea\\listings.html",
      "deadline_display": "December 31, 2025",
      "materials_required": {
        "other": []
      },
      "requirements": null,
      "specializations": [
        "Microeconomics"
      ],
      "start_date": null,
      "salary_range": null,
      "application_link": null,
      "application_portal": null,
      "contact_email": null,
      "contact_person": null,
      "last_updated": null,
      "campus": null,
      "id": "2a72c857c75d0c0a763215a1b58429e3",
      "job_type": "postdoc",
      "processed_date": "2026-01-03",
      "sources": [
        "aea"
      ],
      "is_active": false,
      "is_new": true
    },
    {
      "title": "Apply for This Job (link)",
      "source": "aea",
      "source_url": "https://apply.interfolio.com/177485",
      "description": "Section: US: Other Academic (Visiting or Temporary) Location: Providence, Rhode Island, UNITED STATES JEL Classification: 00 -- 00 - Default: Any Field Application Requirements: External Application URL and Instructions Below Application deadline: 12/31/2025 Application Instructions: Review of applications will begin in January 2026. Applications received by December 31, 2025 will be considered preferentially, but the search will remain open until filled. To be considered for this position, plea",
      "deadline": "2025-12-31",
      "scraped_date": "2026-01-03",
      "source_file": "aea\\listings.html",
      "deadline_display": "December 31, 2025",
      "materials_required": {
        "other": []
      },
      "requirements": null,
      "specializations": [
        "Macroeconomics",
        "Microeconomics",
        "Labor"
      ],
      "start_date": null,
      "salary_range": null,
      "application_link": null,
      "application_portal": null,
      "contact_email": null,
      "contact_person": null,
      "last_updated": null,
      "campus": null,
      "id": "78b50521bffbb65d5a8bd3d7465b88ce",
      "job_type": "visiting",
      "processed_date": "2026-01-03",
      "sources": [
        "aea"
      ],
      "is_active": false,
      "is_new": true
    },
    {
      "title": "Tenure Track or Tenured Professor in Economics",
      "source": "aea",
      "source_url": "https://www.aeaweb.org/joe/listing.php?JOE_ID=2025-02_111476243&q=eNplj0GKwzAMRe-idQZCoJscoFCYOwjV1qTuKHKQnA6h9O51IS6F2UnvS19fd_hOXpJOfsw2w3iHpEihpBvDqKtIB7-8_WWL6EwWLo0616Gsrb2ytDK5r3UZhn44fPUDdJAtTUlJTv-UkFcttqHx9GHmdOOIP1lcIps3GEhjilQYPRjNZ3kHNA6sBbPK1pDsT2ENzobnKtTHKivrKzVSvS3LAuOh72Chafd6PJ6MN19R",
      "description": "Boston College Morrissey College of Arts & Sciences Economics + - Tenure Track or Tenured Professor in Economics Date Posted: 09/17/2025 Section: US: Full-Time Academic (Permanent, Tenure Track or Tenured) Location: Chestnut Hill, Massachusetts, UNITED STATES JEL Classifications: E -- Macroeconomics and Monetary Economics I -- Health, Education, and Welfare J -- Labor and Demographic Economics L -- Industrial Organization Application Requirements: External Application Link Application deadline:",
      "deadline": "2025-12-31",
      "scraped_date": "2026-01-03",
      "source_file": "aea\\listings.html",
      "deadline_display": "December 31, 2025",
      "materials_required": {
        "other": []
      },
      "requirements": null,
      "specializations": [
        "Labor",
        "Macroeconomics",
        "Microeconomics"
      ],
      "start_date": null,
      "salary_range": null,
      "application_link": null,
      "application_portal": null,
      "contact_email": null,
      "contact_person": null,
      "last_updated": null,
      "campus": null,
      "id": "bc6d7aa53bd4e957b6f6c7b497544b1f",
      "job_type": "tenure-track",
      "processed_date": "2026-01-03",
      "sources": [
        "aea"
      ],
      "is_active": false,
      "is_new": true
    },
    {
      "title": "Academic Researcher, Global Economics Governance Initiative",
      "source": "aea",
      "source_url": "https://www.aeaweb.org/joe/listing.php?JOE_ID=2025-02_111476080&q=eNplj0GKwzAMRe-idQZCoJscoFCYOwjV1qTuKHKQnA6h9O51IS6F2UnvS19fd_hOXpJOfsw2w3iHpEihpBvDqKtIB7-8_WWL6EwWLo0616Gsrb2ytDK5r3UZhn44fPUDdJAtTUlJTv-UkFcttqHx9GHmdOOIP1lcIps3GEhjilQYPRjNZ3kHNA6sBbPK1pDsT2ENzobnKtTHKivrKzVSvS3LAuOh72Chafd6PJ6MN19R",
      "description": "Boston University Global Development Policy Center + - Academic Researcher, Global Economics Governance Initiative Date Posted: 08/22/2025 Section: US: Full-Time Academic (Permanent, Tenure Track or Tenured) Location: Boston, Massachusetts, UNITED STATES JEL Classifications: F1 -- Trade F3 -- International Finance O2 -- Development Planning and Policy O1 -- Economic Development Q5 -- Environmental Economics Application Requirements: Application Instructions Below Application deadline: 12/31/2025",
      "deadline": "2025-12-31",
      "scraped_date": "2026-01-03",
      "source_file": "aea\\listings.html",
      "deadline_display": "December 31, 2025",
      "materials_required": {
        "other": []
      },
      "requirements": null,
      "specializations": [
        "Development",
        "Finance",
        "International",
        "Microeconomics"
      ],
      "start_date": null,
      "salary_range": null,
      "application_link": null,
      "application_portal": null,
      "contact_email": null,
      "contact_person": null,
      "last_updated": null,
      "campus": null,
      "id": "556d4115c3b1cffb1edc4048194b3576",
      "job_type": "tenure-track",
      "processed_date": "2026-01-03",
      "sources": [
        "aea"
      ],
      "is_active": false,
      "is_new": true
    },
    {
      "title": "https://jobs.silkroad.com/BU/External/jobs/315747",
      "source": "aea",
      "source_url": "https://jobs.silkroad.com/BU/External/jobs/315746",
      "description": "Section: US: Full-Time Academic (Permanent, Tenure Track or Tenured) Location: Boston, Massachusetts, UNITED STATES JEL Classifications: F1 -- Trade F3 -- International Finance O2 -- Development Planning and Policy O1 -- Economic Development Q5 -- Environmental Economics Application Requirements: Application Instructions Below Application deadline: 12/31/2025 Application Instructions: To apply: Send cover letter and CV to gegi@ bu.edu with subject line: First Name Last Name - GEGI Academic Resea",
      "deadline": "2025-12-31",
      "scraped_date": "2026-01-03",
      "source_file": "aea\\listings.html",
      "deadline_display": "December 31, 2025",
      "materials_required": {
        "cv": true,
        "cover_letter": true,
        "other": []
      },
      "requirements": null,
      "specializations": [
        "Finance",
        "International",
        "Microeconomics",
        "Development"
      ],
      "start_date": null,
      "salary_range": null,
      "application_link": null,
      "application_portal": null,
      "contact_email": null,
      "contact_person": null,
      "last_updated": null,
      "campus": null,
      "id": "f21e486d0c775092267fff15c04f0278",
      "job_type": "tenure-track",
      "processed_date": "2026-01-03",
      "sources": [
        "aea"
      ],
      "is_active": false,
      "is_new": true
    },
    {
      "title": "Stephenson Family Distinguished Professor in Economics (Associate or Full Professor)",
      "source": "aea",
      "source_url": "https://www.aeaweb.org/joe/listing.php?JOE_ID=2025-02_111476292&q=eNplj0GKwzAMRe-idQZCoJscoFCYOwjV1qTuKHKQnA6h9O51IS6F2UnvS19fd_hOXpJOfsw2w3iHpEihpBvDqKtIB7-8_WWL6EwWLo0616Gsrb2ytDK5r3UZhn44fPUDdJAtTUlJTv-UkFcttqHx9GHmdOOIP1lcIps3GEhjilQYPRjNZ3kHNA6sBbPK1pDsT2ENzobnKtTHKivrKzVSvS3LAuOh72Chafd6PJ6MN19R",
      "description": "Appalachian State University Walker College of Business Economics + - Stephenson Family Distinguished Professor in Economics (Associate or Full Professor) Date Posted: 09/23/2025 Section: US: Full-Time Academic (Permanent, Tenure Track or Tenured) Location: Boone, North Carolina, UNITED STATES JEL Classifications: Q0 -- General C9 -- Design of Experiments Application Requirements: External Application URL and Instructions Below Application deadline: 12/01/2025 Application Instructions: Applicant",
      "deadline": "2025-12-01",
      "scraped_date": "2026-01-03",
      "source_file": "aea\\listings.html",
      "deadline_display": "December 1, 2025",
      "materials_required": {
        "other": []
      },
      "requirements": null,
      "specializations": [
        "Microeconomics"
      ],
      "start_date": null,
      "salary_range": null,
      "application_link": null,
      "application_portal": null,
      "contact_email": null,
      "contact_person": null,
      "last_updated": null,
      "campus": null,
      "id": "48c912106a6aa6d2e629eeb2ab3b0a35",
      "job_type": "tenure-track",
      "processed_date": "2026-01-03",
      "sources": [
        "aea"
      ],
      "is_active": false,
      "is_new": true
    },
    {
      "title": "Apply for This Job (link)",
      "source": "aea",
      "source_url": "https://appstate.peopleadmin.com/postings/52038",
      "description": "Section: US: Full-Time Academic (Permanent, Tenure Track or Tenured) Location: Boone, North Carolina, UNITED STATES JEL Classifications: Q0 -- General C9 -- Design of Experiments Application Requirements: External Application URL and Instructions Below Application deadline: 12/01/2025 Application Instructions: Applicants must submit a complete application consisting of a cover letter, curriculum vitae, and the names and contact information of three references. The initial review of applications",
      "deadline": "2025-12-01",
      "scraped_date": "2026-01-03",
      "source_file": "aea\\listings.html",
      "deadline_display": "December 1, 2025",
      "materials_required": {
        "cv": true,
        "cover_letter": true,
        "letters_of_recommendation": true,
        "other": [],
        "research_papers": "job market paper "
      },
      "requirements": null,
      "specializations": [
        "International",
        "Microeconomics"
      ],
      "start_date": null,
      "salary_range": null,
      "application_link": null,
      "application_portal": null,
      "contact_email": null,
      "contact_person": null,
      "last_updated": null,
      "campus": null,
      "id": "1f8bde8552a0c73d19163590db3d5aa4",
      "job_type": "tenure-track",
      "processed_date": "2026-01-03",
      "sources": [
        "aea"
      ],
      "is_active": false,
      "is_new": true
    },
    {
      "title": "Economist/Core Data Scientist",
      "source": "aea",
      "source_url": "https://www.aeaweb.org/joe/listing.php?JOE_ID=2025-02_111476145&q=eNplj0GKwzAMRe-idQZCoJscoFCYOwjV1qTuKHKQnA6h9O51IS6F2UnvS19fd_hOXpJOfsw2w3iHpEihpBvDqKtIB7-8_WWL6EwWLo0616Gsrb2ytDK5r3UZhn44fPUDdJAtTUlJTv-UkFcttqHx9GHmdOOIP1lcIps3GEhjilQYPRjNZ3kHNA6sBbPK1pDsT2ENzobnKtTHKivrKzVSvS3LAuOh72Chafd6PJ6MN19R",
      "description": "Apple Inc. + - Economist/Core Data Scientist Date Posted: 09/08/2025 Section: Full-Time Nonacademic Location: CHINA JEL Classifications: 00 -- 00 - Default: Any Field C -- Mathematical and Quantitative Methods J -- Labor and Demographic Economics L -- Industrial Organization Application Requirements: Letters of Reference External Application Link Application deadline: 07/01/2026 Apply for This Job (link) Request References",
      "deadline": "2026-07-01",
      "scraped_date": "2026-01-03",
      "source_file": "aea\\listings.html",
      "deadline_display": "July 1, 2026",
      "materials_required": {
        "letters_of_recommendation": true,
        "other": []
      },
      "requirements": null,
      "specializations": [
        "Labor",
        "Microeconomics"
      ],
      "start_date": null,
      "salary_range": null,
      "application_link": null,
      "application_portal": null,
      "contact_email": null,
      "contact_person": null,
      "last_updated": null,
      "campus": null,
      "id": "19d731915f9f2ec288de25efb9511295",
      "job_type": "other",
      "processed_date": "2026-01-03",
      "sources": [
        "aea"
      ],
      "is_active": true,
      "is_new": true
    },
    {
      "title": "Apply for This Job (link)",
      "source": "aea",
      "source_url": "https://jobs.apple.com/en-us/details/200328147/economist-core-data-scientist?team=MLAI",
      "description": "Section: Full-Time Nonacademic Location: CHINA JEL Classifications: 00 -- 00 - Default: Any Field C -- Mathematical and Quantitative Methods J -- Labor and Demographic Economics L -- Industrial Organization Application Requirements: Letters of Reference External Application Link Application deadline: 07/01/2026 Apply for This Job (link) Request References",
      "deadline": "2026-07-01",
      "scraped_date": "2026-01-03",
      "source_file": "aea\\listings.html",
      "deadline_display": "July 1, 2026",
      "materials_required": {
        "letters_of_recommendation": true,
        "other": []
      },
      "requirements": null,
      "specializations": [
        "Labor",
        "Microeconomics"
      ],
      "start_date": null,
      "salary_range": null,
      "application_link": null,
      "application_portal": null,
      "contact_email": null,
      "contact_person": null,
      "last_updated": null,
      "campus": null,
      "id": "5cafd8c15ba8c2441a546a705bb7215f",
      "job_type": "other",
      "processed_date": "2026-01-03",
      "sources": [
        "aea"
      ],
      "is_active": true,
      "is_new": true
    },
    {
      "title": "Economist",
      "source": "aea",
      "source_url": "https://www.aeaweb.org/joe/listing.php?JOE_ID=2025-02_111476411&q=eNplj0GKwzAMRe-idQZCoJscoFCYOwjV1qTuKHKQnA6h9O51IS6F2UnvS19fd_hOXpJOfsw2w3iHpEihpBvDqKtIB7-8_WWL6EwWLo0616Gsrb2ytDK5r3UZhn44fPUDdJAtTUlJTv-UkFcttqHx9GHmdOOIP1lcIps3GEhjilQYPRjNZ3kHNA6sBbPK1pDsT2ENzobnKtTHKivrKzVSvS3LAuOh72Chafd6PJ6MN19R",
      "description": "Asian Development Bank Economic Research and Development Impact Department (ERDI) + - Economist Date Posted: 10/07/2025 Section: Full-Time Nonacademic Location: Mandaluyong City, Metro Manila, PHILIPPINES JEL Classification: 00 -- 00 - Default: Any Field Application Requirements: External Application Link Application deadline: 11/26/2025 Apply for This Job (link) + - Senior Economist Date Posted: 10/07/2025 Section: Full-Time Nonacademic Location: Mandaluyong City, Metro Manila, PHILIPPINES JEL",
      "deadline": "2025-11-26",
      "scraped_date": "2026-01-03",
      "source_file": "aea\\listings.html",
      "deadline_display": "November 26, 2025",
      "materials_required": {
        "other": []
      },
      "requirements": null,
      "specializations": [
        "Development",
        "Microeconomics"
      ],
      "start_date": null,
      "salary_range": null,
      "application_link": null,
      "application_portal": null,
      "contact_email": null,
      "contact_person": null,
      "last_updated": null,
      "campus": null,
      "id": "3cf88e856c93957180af03ee7f91df3d",
      "job_type": "other",
      "processed_date": "2026-01-03",
      "sources": [
        "aea"
      ],
      "is_active": false,
      "is_new": true
    },
    {
      "title": "Apply for This Job (link)",
      "source": "aea",
      "source_url": "https://www.adb.org/careers/250755",
      "description": "Section: Full-Time Nonacademic Location: Mandaluyong City, Metro Manila, PHILIPPINES JEL Classification: 00 -- 00 - Default: Any Field Application Requirements: External Application Link Application deadline: 11/26/2025 Apply for This Job (link)",
      "deadline": "2025-11-26",
      "scraped_date": "2026-01-03",
      "source_file": "aea\\listings.html",
      "deadline_display": "November 26, 2025",
      "materials_required": {
        "other": []
      },
      "requirements": null,
      "specializations": [
        "Microeconomics"
      ],
      "start_date": null,
      "salary_range": null,
      "application_link": null,
      "application_portal": null,
      "contact_email": null,
      "contact_person": null,
      "last_updated": null,
      "campus": null,
      "id": "69df061d6726d206d69241864cfa6e55",
      "job_type": "other",
      "processed_date": "2026-01-03",
      "sources": [
        "aea"
      ],
      "is_active": false,
      "is_new": true
    },
    {
      "title": "Assistant Professor of Practice in Macroeconomics",
      "source": "aea",
      "source_url": "https://www.aeaweb.org/joe/listing.php?JOE_ID=2025-02_111476152&q=eNplj0GKwzAMRe-idQZCoJscoFCYOwjV1qTuKHKQnA6h9O51IS6F2UnvS19fd_hOXpJOfsw2w3iHpEihpBvDqKtIB7-8_WWL6EwWLo0616Gsrb2ytDK5r3UZhn44fPUDdJAtTUlJTv-UkFcttqHx9GHmdOOIP1lcIps3GEhjilQYPRjNZ3kHNA6sBbPK1pDsT2ENzobnKtTHKivrKzVSvS3LAuOh72Chafd6PJ6MN19R",
      "description": "Babson College Economics Division Economics + - Assistant Professor of Practice in Macroeconomics Date Posted: 09/10/2025 Section: US: Full-Time Academic (Permanent, Tenure Track or Tenured) Location: Wellesley, Massachusetts, UNITED STATES JEL Classification: E0 -- General Application Requirements: External Application URL and Instructions Below Application deadline: 11/26/2025 Application Instructions: Interested candidates should submit their applications through Babson College's online hirin",
      "deadline": "2025-11-26",
      "scraped_date": "2026-01-03",
      "source_file": "aea\\listings.html",
      "deadline_display": "November 26, 2025",
      "materials_required": {
        "other": []
      },
      "requirements": null,
      "specializations": [
        "Macroeconomics",
        "Microeconomics"
      ],
      "start_date": null,
      "salary_range": null,
      "application_link": null,
      "application_portal": null,
      "contact_email": null,
      "contact_person": null,
      "last_updated": null,
      "campus": null,
      "id": "ae99e2f52830e65365c55a6235a24e42",
      "job_type": "tenure-track",
      "processed_date": "2026-01-03",
      "sources": [
        "aea"
      ],
      "is_active": false,
      "is_new": true
    },
    {
      "title": "Assistant Professor of Finance",
      "source": "aea",
      "source_url": "https://www.aeaweb.org/joe/listing.php?JOE_ID=2025-02_111476333&q=eNplj0GKwzAMRe-idQZCoJscoFCYOwjV1qTuKHKQnA6h9O51IS6F2UnvS19fd_hOXpJOfsw2w3iHpEihpBvDqKtIB7-8_WWL6EwWLo0616Gsrb2ytDK5r3UZhn44fPUDdJAtTUlJTv-UkFcttqHx9GHmdOOIP1lcIps3GEhjilQYPRjNZ3kHNA6sBbPK1pDsT2ENzobnKtTHKivrKzVSvS3LAuOh72Chafd6PJ6MN19R",
      "description": "Assumption University + - Assistant Professor of Finance Date Posted: 09/25/2025 Section: US: Full-Time Academic (Permanent, Tenure Track or Tenured) Location: Worcester, Massachusetts, UNITED STATES JEL Classifications: A -- General Economics and Teaching G -- Financial Economics E -- Macroeconomics and Monetary Economics Application Requirements: External Application Link Letters of Reference Instructions Below Letters of Reference Link Application deadline: 11/15/2025 Reference Instructions:",
      "deadline": "2025-11-15",
      "scraped_date": "2026-01-03",
      "source_file": "aea\\listings.html",
      "deadline_display": "November 15, 2025",
      "materials_required": {
        "letters_of_recommendation": 2025,
        "other": []
      },
      "requirements": null,
      "specializations": [
        "Finance",
        "Macroeconomics",
        "Microeconomics"
      ],
      "start_date": null,
      "salary_range": null,
      "application_link": null,
      "application_portal": null,
      "contact_email": null,
      "contact_person": null,
      "last_updated": null,
      "campus": null,
      "id": "a046dc252d3b365ac435cc92464db9d2",
      "job_type": "tenure-track",
      "processed_date": "2026-01-03",
      "sources": [
        "aea"
      ],
      "is_active": false,
      "is_new": true
    },
    {
      "title": "https://www.assumption.edu/people-and-departments/ ...",
      "source": "aea",
      "source_url": "https://www.assumption.edu/people-and-departments/organization-listing/office-human-resources",
      "description": "Section: US: Full-Time Academic (Permanent, Tenure Track or Tenured) Location: Worcester, Massachusetts, UNITED STATES JEL Classifications: A -- General Economics and Teaching G -- Financial Economics E -- Macroeconomics and Monetary Economics Application Requirements: External Application Link Letters of Reference Instructions Below Letters of Reference Link Application deadline: 11/15/2025 Reference Instructions: Application Instructions To apply, please submit a detailed letter of interest, c",
      "deadline": "2025-11-15",
      "scraped_date": "2026-01-03",
      "source_file": "aea\\listings.html",
      "deadline_display": "November 15, 2025",
      "materials_required": {
        "letters_of_recommendation": 2025,
        "other": []
      },
      "requirements": null,
      "specializations": [
        "Finance",
        "Macroeconomics",
        "Microeconomics"
      ],
      "start_date": null,
      "salary_range": null,
      "application_link": null,
      "application_portal": null,
      "contact_email": null,
      "contact_person": null,
      "last_updated": null,
      "campus": null,
      "id": "cb5c71ce9040f359a1330bf030cfadfa",
      "job_type": "tenure-track",
      "processed_date": "2026-01-03",
      "sources": [
        "aea"
      ],
      "is_active": false,
      "is_new": true
    },
    {
      "title": "Two Assistant Professor Positions in Economics",
      "source": "aea",
      "source_url": "https://www.aeaweb.org/joe/listing.php?JOE_ID=2025-02_111476402&q=eNplj0GKwzAMRe-idQZCoJscoFCYOwjV1qTuKHKQnA6h9O51IS6F2UnvS19fd_hOXpJOfsw2w3iHpEihpBvDqKtIB7-8_WWL6EwWLo0616Gsrb2ytDK5r3UZhn44fPUDdJAtTUlJTv-UkFcttqHx9GHmdOOIP1lcIps3GEhjilQYPRjNZ3kHNA6sBbPK1pDsT2ENzobnKtTHKivrKzVSvS3LAuOh72Chafd6PJ6MN19R",
      "description": "Bocconi University Department of Economics + - Two Assistant Professor Positions in Economics Date Posted: 10/03/2025 Section: International: Full-Time Academic (Permanent, Tenure Track or Tenured) Location: Milano, ITALY JEL Classification: A1 -- General Economics Application Requirements: External Application URL and Instructions Below Letters of Reference Instructions Below Letters of Reference Link Application deadline: 11/15/2025 Reference Instructions: Candidates are required to provide th",
      "deadline": "2025-11-15",
      "scraped_date": "2026-01-03",
      "source_file": "aea\\listings.html",
      "deadline_display": "November 15, 2025",
      "materials_required": {
        "letters_of_recommendation": 2025,
        "other": []
      },
      "requirements": null,
      "specializations": [
        "International",
        "Microeconomics"
      ],
      "start_date": null,
      "salary_range": null,
      "application_link": null,
      "application_portal": null,
      "contact_email": null,
      "contact_person": null,
      "last_updated": null,
      "campus": null,
      "id": "d8e240e8c53c429693a32c3f0638369a",
      "job_type": "tenure-track",
      "processed_date": "2026-01-03",
      "sources": [
        "aea"
      ],
      "is_active": false,
      "is_new": true
    },
    {
      "title": "Apply for This Job (link)",
      "source": "aea",
      "source_url": "https://jobmarket.unibocconi.eu/?id=857",
      "description": "Section: International: Full-Time Academic (Permanent, Tenure Track or Tenured) Location: Milano, ITALY JEL Classification: A1 -- General Economics Application Requirements: External Application URL and Instructions Below Letters of Reference Instructions Below Letters of Reference Link Application deadline: 11/15/2025 Reference Instructions: Candidates are required to provide the contact details of three highly qualified academic referees. Each referee will automatically receive an email from t",
      "deadline": "2025-11-15",
      "scraped_date": "2026-01-03",
      "source_file": "aea\\listings.html",
      "deadline_display": "November 15, 2025",
      "materials_required": {
        "letters_of_recommendation": 2025,
        "other": []
      },
      "requirements": null,
      "specializations": [
        "International",
        "Microeconomics"
      ],
      "start_date": null,
      "salary_range": null,
      "application_link": null,
      "application_portal": null,
      "contact_email": null,
      "contact_person": null,
      "last_updated": null,
      "campus": null,
      "id": "f49fec48d9b20ab38eb85456fb8e1622",
      "job_type": "tenure-track",
      "processed_date": "2026-01-03",
      "sources": [
        "aea"
      ],
      "is_active": false,
      "is_new": true
    },
    {
      "title": "Assistant/Associate Professor of Economics",
      "source": "aea",
      "source_url": "https://www.aeaweb.org/joe/listing.php?JOE_ID=2025-02_111476826&q=eNplj0GKwzAMRe-idQZCoJscoFCYOwjV1qTuKHKQnA6h9O51IS6F2UnvS19fd_hOXpJOfsw2w3iHpEihpBvDqKtIB7-8_WWL6EwWLo0616Gsrb2ytDK5r3UZhn44fPUDdJAtTUlJTv-UkFcttqHx9GHmdOOIP1lcIps3GEhjilQYPRjNZ3kHNA6sBbPK1pDsT2ENzobnKtTHKivrKzVSvS3LAuOh72Chafd6PJ6MN19R",
      "description": "Auburn University Department of Economics + - Assistant/Associate Professor of Economics Date Posted: 11/07/2025 Section: US: Full-Time Academic (Permanent, Tenure Track or Tenured) Location: Auburn, Alabama, UNITED STATES JEL Classifications: E -- Macroeconomics and Monetary Economics F -- International Economics Application Requirements: External Application URL and Instructions Below Application deadline: 02/28/2026 Application Instructions: Applicants should submit a cover letter, curriculum",
      "deadline": "2026-02-28",
      "scraped_date": "2026-01-03",
      "source_file": "aea\\listings.html",
      "deadline_display": "February 28, 2026",
      "materials_required": {
        "cover_letter": true,
        "other": []
      },
      "requirements": null,
      "specializations": [
        "International",
        "Macroeconomics",
        "Microeconomics"
      ],
      "start_date": null,
      "salary_range": null,
      "application_link": null,
      "application_portal": null,
      "contact_email": null,
      "contact_person": null,
      "last_updated": null,
      "campus": null,
      "id": "105b410a739889a34754741b0bf46a47",
      "job_type": "tenure-track",
      "processed_date": "2026-01-03",
      "sources": [
        "aea"
      ],
      "is_active": true,
      "is_new": true
    },
    {
      "title": "http://www.auburn.edu/academic/provost/facultyjobs ...",
      "source": "aea",
      "source_url": "https://www.auburn.edu/academic/provost/facultyjobs/",
      "description": "Section: US: Full-Time Academic (Permanent, Tenure Track or Tenured) Location: Auburn, Alabama, UNITED STATES JEL Classifications: E -- Macroeconomics and Monetary Economics F -- International Economics Application Requirements: External Application URL and Instructions Below Application deadline: 02/28/2026 Application Instructions: Applicants should submit a cover letter, curriculum vitae, one or two working papers, evidence of teaching effectiveness, and contact information for three referenc",
      "deadline": "2026-02-28",
      "scraped_date": "2026-01-03",
      "source_file": "aea\\listings.html",
      "deadline_display": "February 28, 2026",
      "materials_required": {
        "cv": true,
        "cover_letter": true,
        "research_papers": true,
        "other": [],
        "letters_of_recommendation": true
      },
      "requirements": null,
      "specializations": [
        "Macroeconomics",
        "International",
        "Microeconomics"
      ],
      "start_date": null,
      "salary_range": null,
      "application_link": null,
      "application_portal": null,
      "contact_email": null,
      "contact_person": null,
      "last_updated": null,
      "campus": null,
      "id": "87a01c7470883226d8776a0042c0934f",
      "job_type": "tenure-track",
      "processed_date": "2026-01-03",
      "sources": [
        "aea"
      ],
      "is_active": true,
      "is_new": true
    },
    {
      "title": "Assistant/Associate/Full Professor of Business Economics",
      "source": "aea",
      "source_url": "https://www.aeaweb.org/joe/listing.php?JOE_ID=2025-02_111476540&q=eNplj0GKwzAMRe-idQZCoJscoFCYOwjV1qTuKHKQnA6h9O51IS6F2UnvS19fd_hOXpJOfsw2w3iHpEihpBvDqKtIB7-8_WWL6EwWLo0616Gsrb2ytDK5r3UZhn44fPUDdJAtTUlJTv-UkFcttqHx9GHmdOOIP1lcIps3GEhjilQYPRjNZ3kHNA6sBbPK1pDsT2ENzobnKtTHKivrKzVSvS3LAuOh72Chafd6PJ6MN19R",
      "description": "Baker University College of Arts and Sciences Business and Economics + - Assistant/Associate/Full Professor of Business Economics Date Posted: 10/14/2025 Section: US: Full-Time Academic (Permanent, Tenure Track or Tenured) Location: Baldwin City, Kansas, UNITED STATES JEL Classifications: A2 -- Economic Education and Teaching of Economics C1 -- Econometric and Statistical Methods and Methodology: General C7 -- Game Theory and Bargaining Theory D -- Microeconomics E -- Macroeconomics and Monetary",
      "deadline": "2026-04-01",
      "scraped_date": "2026-01-03",
      "source_file": "aea\\listings.html",
      "deadline_display": "April 1, 2026",
      "materials_required": {
        "other": []
      },
      "requirements": null,
      "specializations": [
        "Econometrics",
        "Macroeconomics",
        "Microeconomics"
      ],
      "start_date": null,
      "salary_range": null,
      "application_link": null,
      "application_portal": null,
      "contact_email": null,
      "contact_person": null,
      "last_updated": null,
      "campus": null,
      "id": "aaa329880cf38376bacef4c2832d90b8",
      "job_type": "tenure-track",
      "processed_date": "2026-01-03",
      "sources": [
        "aea"
      ],
      "is_active": true,
      "is_new": true
    },
    {
      "title": "Apply for This Job (link)",
      "source": "aea",
      "source_url": "https://www.bakeru.edu/university-employment/",
      "description": "Section: US: Full-Time Academic (Permanent, Tenure Track or Tenured) Location: Baldwin City, Kansas, UNITED STATES JEL Classifications: A2 -- Economic Education and Teaching of Economics C1 -- Econometric and Statistical Methods and Methodology: General C7 -- Game Theory and Bargaining Theory D -- Microeconomics E -- Macroeconomics and Monetary Economics F -- International Economics G -- Financial Economics I -- Health, Education, and Welfare J -- Labor and Demographic Economics K -- Law and Eco",
      "deadline": "2026-04-01",
      "scraped_date": "2026-01-03",
      "source_file": "aea\\listings.html",
      "deadline_display": "April 1, 2026",
      "materials_required": {
        "other": []
      },
      "requirements": null,
      "specializations": [
        "Econometrics",
        "Finance",
        "International",
        "Labor",
        "Macroeconomics",
        "Microeconomics"
      ],
      "start_date": null,
      "salary_range": null,
      "application_link": null,
      "application_portal": null,
      "contact_email": null,
      "contact_person": null,
      "last_updated": null,
      "campus": null,
      "id": "d4438751aefa025eb2114c4e6178d4dd",
      "job_type": "tenure-track",
      "processed_date": "2026-01-03",
      "sources": [
        "aea"
      ],
      "is_active": true,
      "is_new": true
    },
    {
      "title": "Economist / Researcher",
      "source": "aea",
      "source_url": "https://www.aeaweb.org/joe/listing.php?JOE_ID=2025-02_111475923&q=eNplj0GKwzAMRe-idQZCoJscoFCYOwjV1qTuKHKQnA6h9O51IS6F2UnvS19fd_hOXpJOfsw2w3iHpEihpBvDqKtIB7-8_WWL6EwWLo0616Gsrb2ytDK5r3UZhn44fPUDdJAtTUlJTv-UkFcttqHx9GHmdOOIP1lcIps3GEhjilQYPRjNZ3kHNA6sBbPK1pDsT2ENzobnKtTHKivrKzVSvS3LAuOh72Chafd6PJ6MN19R",
      "description": "Banco de la Repblica + - Economist / Researcher Date Posted: 08/01/2025 Section: Full-Time Nonacademic Location: Bogota, Cundinamarca, COLOMBIA JEL Classifications: E -- Macroeconomics and Monetary Economics F3 -- International Finance F4 -- Macroeconomic Aspects of International Trade and Finance H -- Public Economics Application Requirements: CV Job Market Paper Cover Letter Letters of Reference Application deadline: 01/01/2027 Apply for This Job",
      "deadline": "2027-01-01",
      "scraped_date": "2026-01-03",
      "source_file": "aea\\listings.html",
      "deadline_display": "January 1, 2027",
      "materials_required": {
        "cv": true,
        "cover_letter": true,
        "research_papers": "job market paper ",
        "other": []
      },
      "requirements": null,
      "specializations": [
        "Finance",
        "International",
        "Macroeconomics",
        "Microeconomics",
        "Public"
      ],
      "start_date": null,
      "salary_range": null,
      "application_link": null,
      "application_portal": null,
      "contact_email": null,
      "contact_person": null,
      "last_updated": null,
      "campus": null,
      "id": "7683d4e20fbe1dd13e6e2af99090814c",
      "job_type": "other",
      "processed_date": "2026-01-03",
      "sources": [
        "aea"
      ],
      "is_active": true,
      "is_new": true
    },
    {
      "title": "Apply for This Job",
      "source": "aea",
      "source_url": null,
      "description": "Section: Full-Time Nonacademic Location: Bogota, Cundinamarca, COLOMBIA JEL Classifications: E -- Macroeconomics and Monetary Economics F3 -- International Finance F4 -- Macroeconomic Aspects of International Trade and Finance H -- Public Economics Application Requirements: CV Job Market Paper Cover Letter Letters of Reference Application deadline: 01/01/2027 Apply for This Job",
      "deadline": "2027-01-01",
      "scraped_date": "2026-01-03",
      "source_file": "aea\\listings.html",
      "deadline_display": "January 1, 2027",
      "materials_required": {
        "cv": true,
        "cover_letter": true,
        "research_papers": "job market paper ",
        "other": []
      },
      "requirements": null,
      "specializations": [
        "Finance",
        "International",
        "Macroeconomics",
        "Microeconomics",
        "Public"
      ],
      "start_date": null,
      "salary_range": null,
      "application_link": null,
      "application_portal": null,
      "contact_email": null,
      "contact_person": null,
      "last_updated": null,
      "campus": null,
      "id": "e36072e9ce42d5c94d71f767ccf8adfe",
      "job_type": "other",
      "processed_date": "2026-01-03",
      "sources": [
        "aea"
      ],
      "is_active": true,
      "is_new": true
    },
    {
      "title": "Economic Researcher at Banco de Mxico's Economics Research General Directorate",
      "source": "aea",
      "source_url": "https://www.aeaweb.org/joe/listing.php?JOE_ID=2025-02_111476629&q=eNplj0GKwzAMRe-idQZCoJscoFCYOwjV1qTuKHKQnA6h9O51IS6F2UnvS19fd_hOXpJOfsw2w3iHpEihpBvDqKtIB7-8_WWL6EwWLo0616Gsrb2ytDK5r3UZhn44fPUDdJAtTUlJTv-UkFcttqHx9GHmdOOIP1lcIps3GEhjilQYPRjNZ3kHNA6sBbPK1pDsT2ENzobnKtTHKivrKzVSvS3LAuOh72Chafd6PJ6MN19R",
      "description": "Banco de Mxico Research Directorate + - Economic Researcher at Banco de Mxico's Economics Research General Directorate Date Posted: 11/19/2025 Section: Full-Time Nonacademic Location: Mexico City, CDMX, MEXICO JEL Classifications: C -- Mathematical and Quantitative Methods D -- Microeconomics E -- Macroeconomics and Monetary Economics F -- International Economics G -- Financial Economics J -- Labor and Demographic Economics L -- Industrial Organization O -- Economic Development, Innovation, Te",
      "deadline": "2026-03-31",
      "scraped_date": "2026-01-03",
      "source_file": "aea\\listings.html",
      "deadline_display": "March 31, 2026",
      "materials_required": {
        "other": []
      },
      "requirements": null,
      "specializations": [
        "Development",
        "Finance",
        "International",
        "Labor",
        "Macroeconomics",
        "Microeconomics"
      ],
      "start_date": null,
      "salary_range": null,
      "application_link": null,
      "application_portal": null,
      "contact_email": null,
      "contact_person": null,
      "last_updated": null,
      "campus": null,
      "id": "92a06306c120103bc57bb25b0641a714",
      "job_type": "other",
      "processed_date": "2026-01-03",
      "sources": [
        "aea"
      ],
      "is_active": true,
      "is_new": true
    },
    {
      "title": "Apply for This Job (link)",
      "source": "aea",
      "source_url": "https://econjobmarket.org/positions/11956",
      "description": "Section: Full-Time Nonacademic Location: Mexico City, CDMX, MEXICO JEL Classifications: C -- Mathematical and Quantitative Methods D -- Microeconomics E -- Macroeconomics and Monetary Economics F -- International Economics G -- Financial Economics J -- Labor and Demographic Economics L -- Industrial Organization O -- Economic Development, Innovation, Technological Change, and Growth R -- Urban, Rural, Regional, Real Estate, and Transportation Economics Q -- Agricultural and Natural Resource Econ",
      "deadline": "2026-03-31",
      "scraped_date": "2026-01-03",
      "source_file": "aea\\listings.html",
      "deadline_display": "March 31, 2026",
      "materials_required": {
        "other": []
      },
      "requirements": null,
      "specializations": [
        "Development",
        "Finance",
        "International",
        "Labor",
        "Macroeconomics",
        "Microeconomics"
      ],
      "start_date": null,
      "salary_range": null,
      "application_link": null,
      "application_portal": null,
      "contact_email": null,
      "contact_person": null,
      "last_updated": null,
      "campus": null,
      "id": "14cafea4e4afec40cf3c3d40f33ae428",
      "job_type": "other",
      "processed_date": "2026-01-03",
      "sources": [
        "aea"
      ],
      "is_active": true,
      "is_new": true
    },
    {
      "title": "Visiting Scholars Programme",
      "source": "aea",
      "source_url": "https://www.aeaweb.org/joe/listing.php?JOE_ID=2025-02_111476103&q=eNplj0GKwzAMRe-idQZCoJscoFCYOwjV1qTuKHKQnA6h9O51IS6F2UnvS19fd_hOXpJOfsw2w3iHpEihpBvDqKtIB7-8_WWL6EwWLo0616Gsrb2ytDK5r3UZhn44fPUDdJAtTUlJTv-UkFcttqHx9GHmdOOIP1lcIps3GEhjilQYPRjNZ3kHNA6sBbPK1pDsT2ENzobnKtTHKivrKzVSvS3LAuOh72Chafd6PJ6MN19R",
      "description": "Bank of Finland Research Unit Monetary Policy and Research Department + - Visiting Scholars Programme Date Posted: 08/28/2025 Section: Other Nonacademic (Temporary, Part-Time, Non-Salaried, Consulting, Etc.) Location: Helsinki, FINLAND JEL Classifications: E -- Macroeconomics and Monetary Economics F -- International Economics G -- Financial Economics Application Requirements: External Application URL and Instructions Below Application deadline: 10/05/2025 Application Instructions: Detailed info",
      "deadline": "2025-10-05",
      "scraped_date": "2026-01-03",
      "source_file": "aea\\listings.html",
      "deadline_display": "October 5, 2025",
      "materials_required": {
        "other": []
      },
      "requirements": null,
      "specializations": [
        "Finance",
        "International",
        "Macroeconomics",
        "Microeconomics"
      ],
      "start_date": null,
      "salary_range": null,
      "application_link": null,
      "application_portal": null,
      "contact_email": null,
      "contact_person": null,
      "last_updated": null,
      "campus": null,
      "id": "3f6506f5d65e768f943682c4e714ff58",
      "job_type": "visiting",
      "processed_date": "2026-01-03",
      "sources": [
        "aea"
      ],
      "is_active": false,
      "is_new": true
    },
    {
      "title": "Apply for This Job (link)",
      "source": "aea",
      "source_url": "https://suomenpankki.rekrytointi.com/paikat/?o=A_RJ&jgid=1&jid=1619",
      "description": "Section: Other Nonacademic (Temporary, Part-Time, Non-Salaried, Consulting, Etc.) Location: Helsinki, FINLAND JEL Classifications: E -- Macroeconomics and Monetary Economics F -- International Economics G -- Financial Economics Application Requirements: External Application URL and Instructions Below Application deadline: 10/05/2025 Application Instructions: Detailed information and the application form link are available at https://suomenpankki.rekrytointi.com/paikat/?o=A_RJ&jgid=1&jid=1619 The",
      "deadline": "2025-10-05",
      "scraped_date": "2026-01-03",
      "source_file": "aea\\listings.html",
      "deadline_display": "October 5, 2025",
      "materials_required": {
        "other": []
      },
      "requirements": null,
      "specializations": [
        "Finance",
        "International",
        "Macroeconomics",
        "Microeconomics"
      ],
      "start_date": null,
      "salary_range": null,
      "application_link": null,
      "application_portal": null,
      "contact_email": null,
      "contact_person": null,
      "last_updated": null,
      "campus": null,
      "id": "d3a6adfb19e437c974ea1b5213f1078f",
      "job_type": "visiting",
      "processed_date": "2026-01-03",
      "sources": [
        "aea"
      ],
      "is_active": false,
      "is_new": true
    },
    {
      "title": "Fellowship to Tenure-Track Positions for Research Economists",
      "source": "aea",
      "source_url": "https://www.aeaweb.org/joe/listing.php?JOE_ID=2025-02_111476800&q=eNplj0GKwzAMRe-idQZCoJscoFCYOwjV1qTuKHKQnA6h9O51IS6F2UnvS19fd_hOXpJOfsw2w3iHpEihpBvDqKtIB7-8_WWL6EwWLo0616Gsrb2ytDK5r3UZhn44fPUDdJAtTUlJTv-UkFcttqHx9GHmdOOIP1lcIps3GEhjilQYPRjNZ3kHNA6sBbPK1pDsT2ENzobnKtTHKivrKzVSvS3LAuOh72Chafd6PJ6MN19R",
      "description": "Bank of Italy + - Fellowship to Tenure-Track Positions for Research Economists Date Posted: 10/29/2025 Section: Full-Time Nonacademic Location: ROME, ROME, ITALY JEL Classifications: E5 -- Monetary Policy, Central Banking, and the Supply of Money and Credit D1 -- Household Behavior and Family Economics F3 -- International Finance C1 -- Econometric and Statistical Methods and Methodology: General H3 -- Fiscal Policies and Behavior of Economic Agents J2 -- Demand and Supply of Labor Application Re",
      "deadline": "2025-11-24",
      "scraped_date": "2026-01-03",
      "source_file": "aea\\listings.html",
      "deadline_display": "November 24, 2025",
      "materials_required": {
        "other": []
      },
      "requirements": null,
      "specializations": [
        "Econometrics",
        "Finance",
        "International",
        "Labor",
        "Macroeconomics",
        "Microeconomics"
      ],
      "start_date": null,
      "salary_range": null,
      "application_link": null,
      "application_portal": null,
      "contact_email": null,
      "contact_person": null,
      "last_updated": null,
      "campus": null,
      "id": "2988e01a78d7b8c80d07040d52c03357",
      "job_type": "tenure-track",
      "processed_date": "2026-01-03",
      "sources": [
        "aea"
      ],
      "is_active": false,
      "is_new": true
    },
    {
      "title": "Apply for This Job (link)",
      "source": "aea",
      "source_url": "http://www.bancaditalia.it/bancaditalia/lavorare/fellowship",
      "description": "Section: Full-Time Nonacademic Location: ROME, ROME, ITALY JEL Classifications: E5 -- Monetary Policy, Central Banking, and the Supply of Money and Credit D1 -- Household Behavior and Family Economics F3 -- International Finance C1 -- Econometric and Statistical Methods and Methodology: General H3 -- Fiscal Policies and Behavior of Economic Agents J2 -- Demand and Supply of Labor Application Requirements: External Application URL and Instructions Below Application deadline: 11/24/2025 Applicatio",
      "deadline": "2025-11-24",
      "scraped_date": "2026-01-03",
      "source_file": "aea\\listings.html",
      "deadline_display": "November 24, 2025",
      "materials_required": {
        "other": []
      },
      "requirements": null,
      "specializations": [
        "Econometrics",
        "Finance",
        "International",
        "Labor",
        "Macroeconomics",
        "Microeconomics"
      ],
      "start_date": null,
      "salary_range": null,
      "application_link": null,
      "application_portal": null,
      "contact_email": null,
      "contact_person": null,
      "last_updated": null,
      "campus": null,
      "id": "5bd285d8bbf2dde39c0139ecab09ab3c",
      "job_type": "other",
      "processed_date": "2026-01-03",
      "sources": [
        "aea"
      ],
      "is_active": false,
      "is_new": true
    },
    {
      "title": "Economist",
      "source": "aea",
      "source_url": "https://www.aeaweb.org/joe/listing.php?JOE_ID=2025-02_111476708&q=eNplj0GKwzAMRe-idQZCoJscoFCYOwjV1qTuKHKQnA6h9O51IS6F2UnvS19fd_hOXpJOfsw2w3iHpEihpBvDqKtIB7-8_WWL6EwWLo0616Gsrb2ytDK5r3UZhn44fPUDdJAtTUlJTv-UkFcttqHx9GHmdOOIP1lcIps3GEhjilQYPRjNZ3kHNA6sBbPK1pDsT2ENzobnKtTHKivrKzVSvS3LAuOh72Chafd6PJ6MN19R",
      "description": "Bank of Korea + - Economist Date Posted: 11/03/2025 Section: Full-Time Nonacademic Location: SEOUL, KOREA, REPUBLIC OF JEL Classifications: C -- Mathematical and Quantitative Methods C0 -- General C1 -- Econometric and Statistical Methods and Methodology: General C5 -- Econometric Modeling D -- Microeconomics E -- Macroeconomics and Monetary Economics F -- International Economics G -- Financial Economics H -- Public Economics I -- Health, Education, and Welfare J -- Labor and Demographic Economi",
      "deadline": "2025-11-24",
      "scraped_date": "2026-01-03",
      "source_file": "aea\\listings.html",
      "deadline_display": "November 24, 2025",
      "materials_required": {
        "other": []
      },
      "requirements": null,
      "specializations": [
        "Econometrics",
        "Finance",
        "International",
        "Labor",
        "Macroeconomics",
        "Microeconomics",
        "Public"
      ],
      "start_date": null,
      "salary_range": null,
      "application_link": null,
      "application_portal": null,
      "contact_email": null,
      "contact_person": null,
      "last_updated": null,
      "campus": null,
      "id": "7b4e9efa46b647a29b6aa9b4c4061d14",
      "job_type": "other",
      "processed_date": "2026-01-03",
      "sources": [
        "aea"
      ],
      "is_active": false,
      "is_new": true
    },
    {
      "title": "https://apply.bok.or.kr/",
      "source": "aea",
      "source_url": "https://apply.bok.or.kr/",
      "description": "Section: Full-Time Nonacademic Location: SEOUL, KOREA, REPUBLIC OF JEL Classifications: C -- Mathematical and Quantitative Methods C0 -- General C1 -- Econometric and Statistical Methods and Methodology: General C5 -- Econometric Modeling D -- Microeconomics E -- Macroeconomics and Monetary Economics F -- International Economics G -- Financial Economics H -- Public Economics I -- Health, Education, and Welfare J -- Labor and Demographic Economics L -- Industrial Organization P2 -- Socialist and",
      "deadline": "2025-11-24",
      "scraped_date": "2026-01-03",
      "source_file": "aea\\listings.html",
      "deadline_display": "November 24, 2025",
      "materials_required": {
        "other": []
      },
      "requirements": null,
      "specializations": [
        "Econometrics",
        "Finance",
        "International",
        "Labor",
        "Macroeconomics",
        "Microeconomics",
        "Public"
      ],
      "start_date": null,
      "salary_range": null,
      "application_link": null,
      "application_portal": null,
      "contact_email": null,
      "contact_person": null,
      "last_updated": null,
      "campus": null,
      "id": "bf12503981767ef8fcee9815b2e0771b",
      "job_type": "other",
      "processed_date": "2026-01-03",
      "sources": [
        "aea"
      ],
      "is_active": false,
      "is_new": true
    },
    {
      "title": "Economist",
      "source": "aea",
      "source_url": "https://www.aeaweb.org/joe/listing.php?JOE_ID=2025-02_111476200&q=eNplj0GKwzAMRe-idQZCoJscoFCYOwjV1qTuKHKQnA6h9O51IS6F2UnvS19fd_hOXpJOfsw2w3iHpEihpBvDqKtIB7-8_WWL6EwWLo0616Gsrb2ytDK5r3UZhn44fPUDdJAtTUlJTv-UkFcttqHx9GHmdOOIP1lcIps3GEhjilQYPRjNZ3kHNA6sBbPK1pDsT2ENzobnKtTHKivrKzVSvS3LAuOh72Chafd6PJ6MN19R",
      "description": "Bank of Japan Institute for Monetary and Economic Studies + - Economist Date Posted: 09/16/2025 Section: Other Nonacademic (Temporary, Part-Time, Non-Salaried, Consulting, Etc.) Location: Tokyo, JAPAN JEL Classifications: C -- Mathematical and Quantitative Methods E -- Macroeconomics and Monetary Economics F -- International Economics G -- Financial Economics O -- Economic Development, Innovation, Technological Change, and Growth Application Requirements: Application Instructions Below Letters o",
      "deadline": "2025-11-28",
      "scraped_date": "2026-01-03",
      "source_file": "aea\\listings.html",
      "deadline_display": "November 28, 2025",
      "materials_required": {
        "other": []
      },
      "requirements": null,
      "specializations": [
        "Development",
        "Finance",
        "International",
        "Macroeconomics",
        "Microeconomics"
      ],
      "start_date": null,
      "salary_range": null,
      "application_link": null,
      "application_portal": null,
      "contact_email": null,
      "contact_person": null,
      "last_updated": null,
      "campus": null,
      "id": "6fa296a8231d92defcfe6fc957bb6f88",
      "job_type": "visiting",
      "processed_date": "2026-01-03",
      "sources": [
        "aea"
      ],
      "is_active": false,
      "is_new": true
    },
    {
      "title": "Lecturer of Economics",
      "source": "aea",
      "source_url": "https://www.aeaweb.org/joe/listing.php?JOE_ID=2025-02_111476915&q=eNplj0GKwzAMRe-idQZCoJscoFCYOwjV1qTuKHKQnA6h9O51IS6F2UnvS19fd_hOXpJOfsw2w3iHpEihpBvDqKtIB7-8_WWL6EwWLo0616Gsrb2ytDK5r3UZhn44fPUDdJAtTUlJTv-UkFcttqHx9GHmdOOIP1lcIps3GEhjilQYPRjNZ3kHNA6sBbPK1pDsT2ENzobnKtTHKivrKzVSvS3LAuOh72Chafd6PJ6MN19R",
      "description": "Barnard College Economics Department + - Lecturer of Economics Date Posted: 11/19/2025 Section: US: Full-Time Academic (Permanent, Tenure Track or Tenured) Location: New York, New York, UNITED STATES JEL Classifications: G1 -- General Financial Markets G2 -- Financial Institutions and Services Application Requirements: External Application Link Application deadline: 12/12/2025 Apply for This Job (link) Human Rights Program + - Assistant Professor of Human Rights Date Posted: 12/15/2025 Section:",
      "deadline": "2025-12-12",
      "scraped_date": "2026-01-03",
      "source_file": "aea\\listings.html",
      "deadline_display": "December 12, 2025",
      "materials_required": {
        "other": []
      },
      "requirements": null,
      "specializations": [
        "Finance",
        "Microeconomics"
      ],
      "start_date": null,
      "salary_range": null,
      "application_link": null,
      "application_portal": null,
      "contact_email": null,
      "contact_person": null,
      "last_updated": null,
      "campus": null,
      "id": "1b9367706463f723764e38788188395b",
      "job_type": "tenure-track",
      "processed_date": "2026-01-03",
      "sources": [
        "aea"
      ],
      "is_active": false,
      "is_new": true
    },
    {
      "title": "Apply for This Job (link)",
      "source": "aea",
      "source_url": "https://barnard.wd1.myworkdayjobs.com/en-US/Faculty/job/New-York-City-NY/Lecturer-of-Economics_JR5273",
